ability_id,local_language_id,short_effect,effect
107,5,"Notifie tous les dresseurs en entrant au combat si un adversaire a une capacité [super efficace]{mechanic:super-effective}, []{move:self-destruct}, []{move:explosion}, ou une capacité OHKO.","Quand ce Pokémon entre au combat, si l’un de ses adversaires a une capacité qui est [super efficace]{mechanic:super-effective} contre lui, []{move:self-destruct}, []{move:explosion}, ou une capacité OHKO, tous les dresseurs participants sont notifiés.

La capacité elle-même n’est pas révélée; seulement qu’il y a une telle capacité.  Les capacités qui infligent des [dégâts sans type]{mechanic:typeless-damage}, telles que []{move:future-sight}, et les capacités de type variable, telles que []{move:hidden-power}, comptent comme leur type indiqué.  []{move:counter}, []{move:metal-burst}, []{move:mirror-coat}, et les capacités OHKO desquelles ce Pokémon est immunisés ne déclenchent pas ce talent."
107,6,"Benachrichtigt alle Trainer im Kampf, wenn ein Gegner eine [sehr effektive]{mechanic:super-effective} Attacke, []{move:self-destruct}, []{move:explosion} oder eine K.O.Attacke hat.","Wenn ein Pokémon mit dieser Fähigkeit den Kampf betritt und ein Gegner eine Attacke hat die []{mechanic:super-effective} gegen das Pokémon ist, []{move:self-destruct}, []{move:explosion} oder eine K.O.-Attacke hat, werden alle Trainer darüber benachrichtigt.

Die Attacke selbst wird nicht angekündigt, nur ihre Anwesenheit. Attacken die [typenlosen Schaden]{mechanic:typeless-damage} verursachen, wie []{move:future-sight} und Attacken mit variablen Typ, wie []{move:hidden-power}, werden nach ihrem angezeigten Typ gezählt. []{move:counter}, []{move:metal-burst}, []{move:mirror-coat} und K.O.-Attacken gegen die das Pokémon immun ist werden nicht gezählt."
107,9,"Notifies all trainers upon entering battle if an opponent has a [super-effective]{mechanic:super-effective} move, []{move:self-destruct}, []{move:explosion}, or a one-hit KO move.","When this Pokémon enters battle, if one of its opponents has a move that is [super effective]{mechanic:super-effective} against it, []{move:self-destruct}, []{move:explosion}, or a one-hit knockout move, all participating trainers are notified.

The move itself is not revealed; only that there is such a move.  Moves that inflict [typeless damage]{mechanic:typeless-damage}, such as []{move:future-sight}, and moves of variable type, such as []{move:hidden-power}, count as their listed types.  []{move:counter}, []{move:metal-burst}, []{move:mirror-coat}, and one-hit KO moves to which this Pokémon is immune do not trigger this ability."
108,5,Révèle la capacité la plus puissante des adversaires en entrant au combat.,"Quand ce Pokémon entre au combat, il révèle la capacité avec la puissance de base connue la plus grande par n’importe quel Pokémon adverse à tous les dresseurs participants.

En cas d’égalité, une est choisie au hasard.

Les capacités sans puissance de base indiquée est assignée à une de la mnière suivante:

Puissance | Capacités
----: | -----
  160 | Capacités OHKO: []{move:fissure}, []{move:guillotine}, []{move:horn-drill}, et []{move:sheer-cold}
  120 | Capacités de contre: []{move:counter}, []{move:metal-burst}, et []{move:mirror-coat}
   80 | Puissance variable ou dégâts fixés: []{move:crush-grip}, []{move:dragon-rage}, []{move:electro-ball}, []{move:endeavor}, []{move:final-gambit}, []{move:flail}, []{move:frustration}, []{move:grass-knot}, []{move:gyro-ball}, []{move:heat-crash}, []{move:heavy-slam}, []{move:hidden-power}, []{move:low-kick}, []{move:natural-gift}, []{move:night-shade}, []{move:psywave}, []{move:return}, []{move:reversal}, []{move:seismic-toss}, []{move:sonic-boom}, []{move:trump-card}, et []{move:wring-out}
    0 | Aucune des capacités listées
"
108,6,Enthüllt die Stärkste Attacke des Gegners beim Betreten des Kampfes.,"Wenn ein Pokémon mit dieser Fähigkeit den Kampf betritt, wird die Attacke mit der höchsten Basisstärke eines der Gegner an alle Trainer angekündigt.

Wenn es mehrere gleichstarke Attacken gibt, wird eine zufällige gewählt.

Attacken ohne angezeigt Basisstärke werden wie folgt behandelt:

Stärke | Attacken
 ----: | -----
   160 | K.O.-Attacken: []{move:fissure}, []{move:guillotine}, []{move:horn-drill} und []{move:sheer-cold}
   120 | Konter-Attacken: []{move:counter}, []{move:metal-burst} und []{move:mirror-coat}
    80 | Variable Stärke oder fester Schaden: []{move:crush-grip}, []{move:dragon-rage}, []{move:electro-ball}, []{move:endeavor}, []{move:final-gambit}, []{move:flail}, []{move:frustration}, []{move:grass-knot}, []{move:gyro-ball}, []{move:heat-crash}, []{move:heavy-slam}, []{move:hidden-power}, []{move:low-kick}, []{move:natural-gift}, []{move:night-shade}, []{move:psywave}, []{move:return}, []{move:reversal}, []{move:seismic-toss}, []{move:sonic-boom}, []{move:trump-card} und []{move:wring-out}
     0 | Jede andere Attacke
"
108,9,Reveals the opponents' strongest move upon entering battle.,"When this Pokémon enters battle, it reveals the move with the highest base power known by any opposing Pokémon to all participating trainers.

In the event of a tie, one is chosen at random.

Moves without a listed base power are assigned one as follows:

Power | Moves
----: | -----
  160 | One-hit KO moves: []{move:fissure}, []{move:guillotine}, []{move:horn-drill}, and []{move:sheer-cold}
  120 | Counter moves: []{move:counter}, []{move:metal-burst}, and []{move:mirror-coat}
   80 | Variable power or set damage: []{move:crush-grip}, []{move:dragon-rage}, []{move:electro-ball}, []{move:endeavor}, []{move:final-gambit}, []{move:flail}, []{move:frustration}, []{move:grass-knot}, []{move:gyro-ball}, []{move:heat-crash}, []{move:heavy-slam}, []{move:hidden-power}, []{move:low-kick}, []{move:natural-gift}, []{move:night-shade}, []{move:psywave}, []{move:return}, []{move:reversal}, []{move:seismic-toss}, []{move:sonic-boom}, []{move:trump-card}, and []{move:wring-out}
    0 | Any such move not listed
"
109,5,Ignore les modifications de stat des autres Pokémon pour le calcul des dégâts et précision.,"Ce Pokémon ignore les [modifications de stat]{mechanic:stat-modifiers} des autres Pokémon aux fins des calculs de dégâts et de précision.

En réalité, ceci affecte les modifications de toutes les stats sauf la [Vitesse]{mechanic:speed}.

La puissance de []{move:punishment} et []{move:stored-power} est calculée normalement.  Quand ce Pokémon se blesse dans la [confusion]{mechanic:confusion}, ses modifications de stat affectent les dégâts normalement."
109,6,Ignoriert die []{mechanic:stat-modifier} der Pokémon bei der Schadens- und [Genauigkeitsberechnung]{mechanic:accuracy}.,"Pokémon mit dieser Fähigkeit ignorieren die []{mechanic:stat-modifier} der Gegner bei der Berechnung des Schadens und der []{mechanic:accuracy}.

Dies beeinflusst effektiv alle Änderungen der Statuswerte außer []{mechanic:speed}.

Die Stärke von []{move:punishment} und []{move:stored-power} wird normal berechnet. Wenn sich das Pokémon wegen []{mechanic:confusion} selbst verletzt, beeinflussen die []{mechanic:stat-modifier} den Schaden wie sonst auch."
109,9,Ignores other Pokémon's stat modifiers for damage and accuracy calculation.,"This Pokémon ignores other Pokémon's [stat modifiers]{mechanic:stat-modifiers} for the purposes of damage and accuracy calculation.

Effectively, this affects modifiers of every stat except [Speed]{mechanic:speed}.

The power of []{move:punishment} and []{move:stored-power} is calculated as usual.  When this Pokémon hurts itself in [confusion]{mechanic:confusion}, its stat modifiers affect damage as usual."
110,5,Double les dégâts infligés avec les capacités [pas très efficaces]{mechanic:not-very-effective} moves.,Ce Pokémon inflige deux fois plus de dégâts avec des capacités qui sont [pas très efficaces]{mechanic:not-very-effective} contre la cible.
110,6,Verdoppelt den durch [nicht sehr effektiven]{mechanic:not-very-effective} Attacken verursachten Schaden.,Pokémon mit dieser Fähigkeit verdoppeln den Schaden von Attacken die []{mechanic:not-very-effective} gegen das Ziel sind.
110,9,Doubles damage inflicted with [not-very-effective]{mechanic:not-very-effective} moves.,This Pokémon deals twice as much damage with moves that are [not very effective]{mechanic:not-very-effective} against the target.
111,5,Réduit les dégâts subis des capacités [super efficaces]{mechanic:super-effective} d'1/4.,"Ce Pokémon subit 0.75× des dégâts des capacités qui sont [super efficaces]{mechanic:super-effective} contre lui.

Ce talent fonctionne de la même manière que []{ability:solid-rock}."
111,6,Reduziert den durch [sehr effektive]{mechanic:super-effective} Attacken verursachten Schaden um 1/4.,"Pokémon mit dieser Fähigkeit erleiden nur 75% des Schadens, der durch Attacken die []{mechanic:super-effective} sind verursacht wurde.

Die Fähigkeit ist identisch mit []{ability:solid-rock}."
111,9,Decreases damage taken from [super-effective]{mechanic:super-effective} moves by 1/4.,"This Pokémon takes 0.75× as much damage from moves that are [super effective]{mechanic:super-effective} against it.

This ability functions identically to []{ability:solid-rock}."
112,5,Divise par deux l'[Attaque]{mechanic:attack} et [Vitesse]{mechanic:speed} pendant cinq tours en entrant au combat.,"L’[Attaque]{mechanic:attack} et [Vitesse]{mechanic:speed} de ce Pokémon sont divisés par deux pendant cinq tours en entrant au combat.

Ce talent s’active aussi quand acquis pendant le combat.  Si ce Pokémon perd son talent avant que les cinq tours s’écoulent, ses Attaque et Vitesse reviennent à la normale; s’il regagne ce talent sans quitter le combat, ses Attaque et Vitesse sont divisées par deux à nouveau, mais le compteur continue de compter d’où il était."
112,6,Halbiert den []{mechanic:attack} und die []{mechanic:speed} 5 Runden lang nach Betreten des Kampfes.,"Der []{mechanic:attack} und die []{mechanic:speed} von Pokémon mit dieser Fähigkeit werden 5 Runden nach Betreten des Kampfes halbiert.

Die Fähigkeit wirkt auch, wenn sie während des Kampfes erlangt wird. Wenn das Pokémon die Fähigkeit nach Beginn des Kampfes verliert, werden sein []{mechanic:attack} und seine []{mechanic:speed} wieder normal, wenn es die Fähigkeit dann wieder erlangt, werden []{mechanic:attack} und []{mechanic:speed} wieder halbiert, aber der Zähler wird nicht zurückgesetzt."
112,9,Halves [Attack]{mechanic:attack} and [Speed]{mechanic:speed} for five turns upon entering battle.,"This Pokémon's [Attack]{mechanic:attack} and [Speed]{mechanic:speed} are halved for five turns upon entering battle.

This ability also takes effect when acquired during battle.  If this Pokémon loses its ability before the five turns are up, its Attack and Speed return to normal; if it then regains this ability without leaving battle, its Attack and Speed are halved again, but the counter keeps counting from where it was."
113,5,Laisse les capacités []{type:normal} et []{type:fighting} du Pokémon frapper les Pokémon []{type:ghost}.,"Ce Pokémon ignore les immunités des Pokémon de type []{type:ghost} aux capacités de type []{type:normal} et []{type:fighting}.

Les autres types des Pokémon Spectre affectent les dégâts normalement."
113,6,Lässt die []{type:normal} und []{type:fighting} Attacken des Pokémons []{type:ghost} Pokémon treffen.,"Pokémon mit dieser Fähigkeit ignorieren die Immunität von []{type:ghost} Pokémon gegen []{type:normal} und []{type:fighting} Attacken.

Der zweite Typ des []{type:ghost} Pokémons beeinflusst den Schaden wie sonst auch."
113,9,Lets the Pokémon's []{type:normal} and []{type:fighting} moves hit []{type:ghost} Pokémon.,"This Pokémon ignores []{type:ghost}-type Pokémon's immunity to []{type:normal}- and []{type:fighting}-type moves.

Ghost Pokémon's other types affect damage as usual."
114,5,"Redirige les capacités []{type:water} à cible unique sur ce Pokémon si possible.  Absorbe les capacités Eau, augmentant l'[Attaque Spéciale]{mechanic:special-attack} d'un [niveau]{mechanic:stat-modifier}.","Toutes les capacités à cible unique de type []{type:water} des autres Pokémon sont redirigées sur ce Pokémon, s’il est une cible éligible.  Les capacités Eau des autres Pokémon augmentent l’[Attaque Spéciale]{mechanic:special-attack} de ce Pokémon d’un [niveau]{mechanic:stat-modifier}, annulant n’importe quel autre effet sur lui, et ne peut pas le manquer.

Si la cible prévue de la capacité a aussi ce talent, la capacité n’est pas redirigée.  Quand plusieurs Pokémon avec ce talent sont des cibles possibles pour la redirection, la capacité est redirigée vers celle avec la plus grande stat de [Vitesse]{mechanic:speed}, ou, en cas d’égalité, vers un Pokémon aléatoire de l’égalité.  []{move:follow-me} prend la priorité sur ce talent."
114,6,Leitet []{type:water} Attacken auf dieses Pokémon um. Absorbiert []{type:water} Attacken und erhöht den []{mechanic:special-attack} um 1 [Stufe]{mechanic:stat-modifier}.,"Alle []{type:water} Attacken von anderen Pokémon mit nur einem Ziel werden auf das Pokémon mit dieser Fähigkeit umgeleitet, wenn es ein mögliches Ziel ist. []{type:water} die dieses Pokémon treffen erhöhen seinen []{mechanic:special-attack} um eine [Stufe]{mechanic:stat-modifier}, wobei jeder andere Effekt entfernt wird. Die Attacke kann außerdem nicht daneben gehen.

Wenn das eigentliche Ziel der Attacke die Fähigkeit ebenfalls hat, wird die Attacke nicht umgeleitet. Wenn mehrere Pokémon mit dieser Fähigkeit mögliche Ziele sind, wird die Attacke zu dem mit der höchsten []{mechanic:speed}, oder, bei Gleichstand, zu einem zufälligen Pokémon umgeleitet. []{move:follow-me} erhält vor dieser Fähigkeit den Vorzug."
114,9,"Redirects single-target []{type:water} moves to this Pokémon where possible.  Absorbs Water moves, raising [Special Attack]{mechanic:special-attack} one [stage]{mechanic:stat-modifier}.","All other Pokémon's single-target []{type:water}-type moves are redirected to this Pokémon, if it is an eligible target.  Other Pokémon's Water moves raise this Pokémon's [Special Attack]{mechanic:special-attack} one [stage]{mechanic:stat-modifier}, negating any other effect on it, and cannot miss it.

If the move's intended target also has this ability, the move is not redirected.  When multiple Pokémon with this ability are possible targets for redirection, the move is redirected to the one with the highest [Speed]{mechanic:speed} stat, or, in the case of a tie, to a random tied Pokémon.  []{move:follow-me} takes precedence over this ability."
115,5,Soigne 1/16 des [PV]{mechanic:hp} max après chaque tour sous grêle.  Protège contre les dégâts de la grêle.,"Ce Pokémon se soigne d'1/16 de ses [PV]{mechanic:hp} maximum après chaque tour sous [grêle]{mechanic:hail}, et il ne subit pas les dégâts de la grêle peu importe son type."
115,6,Heilt jede Runde 1/16 der max []{mechanic:hp} wenn es [hagelt]{mechanic:hail}. Schützt vor Schäden durch []{mechanic:hail}.,Pokémon mit dieser Fähigkeit heilen am Ende jeder Runde 1/16 ihrer maximalen [HP]{mechanic:hp} wenn es [hagelt]{mechanic:hail} und sie nehmen durch []{mechanic:hail} keinen Schaden unabhängig von ihrem Typ.
115,9,Heals for 1/16 max [HP]{mechanic:hp} after each turn during hail.  Protects against hail damage.,"This Pokémon heals for 1/16 of its maximum [HP]{mechanic:hp} after each turn during [hail]{mechanic:hail}, and it does not take hail damage regardless of type."
116,5,Diminue les dégâts subis des capacités [super efficaces]{mechanic:super-effective} de 1/4.,"Ce Pokémon subit 0.75× de dégâts des capacités qui sont [super efficaces]{mechanic:super-effective} contre lui.

Ce talent fonctionne de la même manière que []{ability:filter}."
116,6,Reduziert den durch [sehr effektive]{mechanic:super-effective} Attacken verursachten Schaden um 1/4.,"Pokémon mit dieser Fähigkeit erleiden nur 75% des Schadens, der durch Attacken die []{mechanic:super-effective} sind verursacht wurde.

Die Fähigkeit ist identisch mit []{ability:filter}."
116,9,Decreases damage taken from [super-effective]{mechanic:super-effective} moves by 1/4.,"This Pokémon takes 0.75× as much damage from moves that are [super effective]{mechanic:super-effective} against it.

This ability functions identically to []{ability:filter}."
117,5,Invoque une [grêle]{mechanic:hail} qui dure indéfiniment en entrant sur le terrain.,"La [météo]{mechanic:weather} se change en [grêle]{mechanic:hail} quand ce Pokémon entre au combat et ne prend pas fin à moins d’être annulée par une autre condition météo.

Si plusieurs Pokémon avec ce talent, []{ability:drizzle}, []{ability:drought}, ou []{ability:sand-stream} sont envoyés en même temps, les talents s’activent dans l’ordre des [Vitesses]{mechanic:speed}, respectant []{move:trick-room}.  Chaque météo de talent annulera la précédente météo, et seulement la météo invoquée par le Pokémon le plus lent restera."
117,6,Ändert beim Betreten des Kampfes das []{mechanic:weather} in []{mechanic:hail}.,"Das []{mechanic:weather} ändert sich zu []{mechanic:hail}, wenn ein Pokémon mit dieser Fähigkeit den Kampf betritt. Dieser Effekt ist dauerhaft bis das []{mechanic:weather} geändert wird.

Wenn mehrere Pokémon mit dieser Fähigkeit, []{ability:drizzle}, []{ability:drought} oder []{ability:sand-stream} zur selben Zeit den Kampf betreten, werden die Fähigkeiten nach Reihenfolge der []{mechanic:speed} der Pokémon ausgelöst, unter Berücksichtigung von []{move:trick-room}."
117,9,Summons [hail]{mechanic:hail} that lasts indefinitely upon entering battle.,"The [weather]{mechanic:weather} changes to [hail]{mechanic:hail} when this Pokémon enters battle and does not end unless cancelled by another weather condition.

If multiple Pokémon with this ability, []{ability:drizzle}, []{ability:drought}, or []{ability:sand-stream} are sent out at the same time, the abilities will activate in order of [Speed]{mechanic:speed}, respecting []{move:trick-room}.  Each ability's weather will cancel the previous weather, and only the weather summoned by the slowest of the Pokémon will stay."
118,5,Le Pokémon peut ramasser du []{item:honey} après le combat.,"Ce Pokémon a une chance de ramasser du []{item:honey} après chaque combat.  Cette chance commence à 5% et augmente d’un autre 5% après chaque dizaine de niveaux: 5% du niveau 1–10, 10% de 11–20, etc..., jusqu’à 50% de 91–100.

Ce talent est vérifié après que le combat prenne fin, auquel moment n’importe quel changement temporaire de talent sera dissipé."
118,6,Das Pokémon hebt nach dem Kampf gelegentlich []{item:honey} auf.,"Pokémon mit dieser Fähigkeit haben eine Chance nach dem Kampf []{item:honey} aufzuheben. Die Chance startet bei 5% und steigt um weitete 5% mit jedem 10. Level: 5% bei Level 1–10, 10% bei 11–20 und so weiter, bis zu 50% bei 91–100.

Die Fähigkeit wird überprüft wenn der Kampf endet, wenn temporäre Fähigkeiten wieder weg sind."
118,9,The Pokémon may pick up []{item:honey} after battle.,"This Pokémon has a chance of picking up []{item:honey} after each battle.  This chance starts at 5% and rises another 5% after every tenth level: 5% from level 1–10, 10% from 11–20, and so on, up to 50% from 91–100.

This ability is checked after the battle ends, at which point any temporary ability changes have worn off."
119,5,Révèle un objet tenu de l'adversaire en entrant au combat.,"Quand ce Pokémon entre au combat, il révèle un objet tenu d’un Pokémon opposé à tous les dresseurs participants.

Dans un combat double, si un adversaire a un objet, ce Pokémon Fouillera ce Pokémon; si les deux ont un objet, il en Fouillera un au hasard."
119,6,Enthüllt bei Kampfantritt das getragene Item des Gegners.,"Wenn ein Pokémon mit dieser Fähigkeit den Kampf betritt, wird allen Trainern mitgeteilt, welches Item der Gegner hält.

Wenn bei Mehrfachkämpfen ein Gegner ein Item hält, wird dieses angezeigt, wenn mehr ein Item halten wird ein zufälliges angekündigt."
119,9,Reveals an opponent's held item upon entering battle.,"When this Pokémon enters battle, it reveals an opposing Pokémon's held item to all participating trainers.

In a double battle, if one opponent has an item, this Pokémon will Frisk that Pokémon; if both have an item, it will Frisk one at random."
120,5,Renforce les capacités avec contrecoup d'1.2× leur puissance.,"Les capacités à contrecoup de ce Pokémon et capacités d’écrasement ont 1.2× leur puissance de base.

[]{move:struggle} n’est pas affecté.

Les ""capacités d’écrasement"" sont les capacités qui infligent des dégâts au lanceur quand ils manquent leur cible: []{move:jump-kick} et []{move:high-jump-kick}."
120,6,Verstärkt Rückstoßattacken um 20%.,"Rückstoß- und Crashattacken von Pokémon mit dieser Fähigkeit haben 1,2× so viel Basisstärke wie sonst.

[]{move:struggle} ist davon nicht betroffen.

""Crashattacken"" sind solche, die dem Anwender schaden wenn sie fehlschlagen wie []{move:jump-kick} und []{move:high-jump-kick}."
120,9,Strengthens recoil moves to 1.2× their power.,"This Pokémon's recoil moves and crash moves have 1.2× their base power.

[]{move:struggle} is unaffected.

The ""crash moves"" are the moves that damage the user upon missing: []{move:jump-kick} and []{move:high-jump-kick}."
121,5,Change le type et la forme d'[]{pokemon:arceus} pour correspondre à sa Plaque tenue.,"Si ce Pokémon tient une Plaque élémentaire, son type et forme changent pour correspondre à la Plaque.

L’objet tenu de ce Pokémon, qu’il soit une Plaque ou non, ne peut pas être pris par []{move:covet} ou []{move:thief}, ni supprimé par []{move:knock-off}, ni échangé par []{move:switcheroo} ou []{move:trick}.  Implore, Larcin, et Sabotage infligent toujours des dégâts à ce Pokémon.  Contrairement à avec []{ability:sticky-hold}, ce Pokémon ne peut pas utiliser []{move:fling}, Passe-Passe, ou Tour de Magie pour perdre son objet lui-même, ni gagner un objet via Passe-Passe ou Tour de Magie s’il n’en a pas.

Ce talent n’a pas d’effet pour n’importe quel Pokémon autre qu’[]{pokemon:arceus}.  Ce talent ne peut pas être échangé avec []{move:skill-swap}, ni copié avec []{move:role-play} ou []{ability:trace}, ni désactivé avec []{move:gastro-acid}, ni changé avec []{move:worry-seed}.  Ce Pokémon ne peut pas utiliser Échange ou Imitation pour perdre son talent lui-même.  []{ability:mold-breaker} ne peut pas ignorer ce talent.

Si un Pokémon [se transforme]{move:transform} en un Arceus avec ce talent, il se transformera en la forme de type []{type:normal}, par défaut d’Arceus.  Si le Pokémon transformé tient une Plaque, ce talent s’activera alors et changera le Pokémon en la forme correspondante."
121,6,Ändert []{pokemon:arceus} Typ und Form entsprechend der Tafel die es hält.,"Wenn []{pokemon:arceus} eine Tayp-Tafel hält, ändert sich sein Typ und seine Form entsprechend der Tafel.

[]{pokemon:arceus} getragenes Item, egal ob es sich um eine Tafel handelt oder nicht, kann nicht durch []{move:covet} oder []{move:thief} gestohlen, oder mit []{move:knock-off} entfernt werden, noch kann es durch []{move:switcheroo} oder []{move:trick} getauscht werden. []{move:covet}, []{move:thief} and []{move:knock-off} richten trotzdem Schaden an. Anders als []{ability:sticky-hold} kann []{pokemon:arceus} []{move:fling}, []{move:switcheroo} und []{move:trick} nicht benutzen um das Item zu verlieren, noch eines durch []{move:switcheroo} oder []{move:trick} bekommen, wenn es keines trägt.

Die Fähigkeit hat keinen Effekt für Pokémon außer []{pokemon:arceus}. Die Fähigkeit kann nicht durch []{move:skill-swap} getauscht, mit []{move:role-play} bzw. []{ability:trace} kopiert, mit []{move:gastro-acid} deaktiviert oder mit []{move:worry-seed} geändert werden. Das Pokémon kann []{move:skill-swap} oder []{move:role-play} einsetzen um die Fähigkeit zu verlieren. []{ability:mold-breaker} kann diese Fähigkeit nicht ignorieren.

Wenn sich ein Pokémon in ein []{pokemon:arceus} mit dieser Fähigkeit [verwandelt]{move:transform}, wird es sich in []{pokemon:arceus} []{type:normal}form verwandeln. Wenn das sich verwandelnde Pokémon eine Tafel trägt, wird sich die Fähigkeit aktivieren und es in den entsprechenden Typ wandeln."
121,9,Changes []{pokemon:arceus}'s type and form to match its held Plate.,"If this Pokémon is holding an elemental Plate, its type and form change to match the Plate.

This Pokémon's held item, whether or not it is a Plate, cannot be taken by []{move:covet} or []{move:thief}, nor removed by []{move:knock-off}, nor traded by []{move:switcheroo} or []{move:trick}.  Covet, Thief, and Knock Off still inflict damage against this Pokémon.  Unlike with []{ability:sticky-hold}, this Pokémon cannot use []{move:fling}, Switcheroo, or Trick to lose its item itself, nor gain an item through Switcheroo or Trick if it does not have one.

This ability has no effect for any Pokémon other than []{pokemon:arceus}.  This ability cannot be traded with []{move:skill-swap}, nor copied with []{move:role-play} or []{ability:trace}, nor disabled with []{move:gastro-acid}, nor changed with []{move:worry-seed}.  This Pokémon cannot use Skill Swap or Role Play to lose its ability itself.  []{ability:mold-breaker} cannot ignore this ability.

If a Pokémon [Transforms]{move:transform} into an Arceus with this ability, it will Transform into Arceus's default, []{type:normal}-type form.  If the Transforming Pokémon is holding a Plate, this ability will then activate and change the Pokémon into the corresponding form."
