ability_id,local_language_id,short_effect,effect
149,9,Takes the appearance of the last conscious party Pokémon upon being sent out until hit by a damaging move.,"This Pokémon, upon being sent out, appears to have the species, nickname, and Poké Ball of the last Pokémon in the party that is able to battle.  This illusion breaks upon being hit by a damaging move.

Other damage, e.g. from [weather]{mechanic:weather} or []{move:spikes}, does not break the illusion, nor does damage done to a []{move:substitute}.

If the party order becomes temporarily shuffled around as Pokémon are switched out in battle, this ability chooses the last Pokémon according to that shuffled order."
150,5,[Se transforme]{move:transform} en entrant au combat.,Ce Pokémon se transforme en un adversaire aléatoire en entrant au combat.  Cet effet est identique à la capacité []{move:transform}.
150,6,[Verwandelt]{move:transform} sich beim Betreten des Kampfes in den Gegner.,Pokémon mit dieser Fähigkeit kopieren einen zufälligen Gegner. Der Effekt ist identisch mit []{move:transform}.
150,9,[Transforms]{move:transform} upon entering battle.,This Pokémon transforms into a random opponent upon entering battle.  This effect is identical to the move []{move:transform}.
151,5,"Outrepasse []{move:light-screen}, []{move:reflect}, et []{move:safeguard}.","Les capacités de ce Pokémon ignorent []{move:light-screen}, []{move:reflect}, et []{move:safeguard}."
151,6,"Umgeht []{move:light-screen}, []{move:reflect} und []{move:safeguard}.","Pokémon mit dieser Fähigkeit ignorieren []{move:light-screen}, []{move:reflect} und []{move:safeguard}."
151,9,"Bypasses []{move:light-screen}, []{move:reflect}, and []{move:safeguard}.","This Pokémon's moves ignore []{move:light-screen}, []{move:reflect}, and []{move:safeguard}."
152,5,Change les talents des Pokémon attaquants en Momie en cas de contact.,"Quand une capacité de contact touche ce Pokémon, le talent du Pokémon attaquant change en Momie.

[]{ability:multitype} n’est pas affecté.  Si un Pokémon avec []{ability:moxie} met ce Pokémon KO, le talent du premier changera sans prendre effet."
152,6,Ändert bei Kontakt die Fähigkeit von Angreifern in Mumie.,"Wenn ein Pokémon mit dieser Fähigkeit von einer Attacke mit Kontakt getroffen wird, ändert sich die Fähigkeit des Gegners in Mumie.

[]{ability:multitype} ist nicht betroffen. Wenn das Pokémon von einem mit der Fähigkeit []{ability:moxie} besiegt wird, ändert sich dessen Fähigkeit ohne ihren Effekt auszulösen."
152,9,Changes attacking Pokémon's abilities to Mummy on contact.,"Whenever a contact move hits this Pokémon, the attacking Pokémon's ability changes to Mummy.

[]{ability:multitype} is unaffected.  If a Pokémon with []{ability:moxie} knocks this Pokémon out, the former's ability will change without taking effect."
153,5,Augmente l'[Attaque]{mechanic:attack} d'un niveau en mettant un Pokémon KO.,"L’[Attaque]{mechanic:attack} de ce Pokémon augmente d’un niveau en mettant KO un autre Pokémon, même un Pokémon allié.

Ce talent ne s’active pas quand le Pokémon met KO un autre Pokémon indirectement, e.g. via le [poison]{mechanic:poison} ou []{move:spikes}.

Si ce Pokémon met KO un Pokémon avec []{ability:mummy}, le talent du premier changera sans prendre effet."
153,6,"Erhöht den []{mechanic:attack} um 1 [Stufe]{mechanic:stat-modifier}, wenn es einen Gegner besiegt.","Der []{mechanic:attack} von Pokémon mit dieser Fähigkeit erhöht sich um 1 [Stufe]{mechanic:stat-modifier}, wenn es einen Gegner oder einen Teampartner besiegt.

Die Fähigkeit löst nicht aus, wenn der Gegner indirekt besiegt wird, z.B. durch []{mechanic:poison} oder []{move:spikes}.

Wenn der besiegte Gegner die Fähigkeit []{ability:mummy} hat, ändert sich die Fähigkeit ohne den alten Effekt auszulösen."
153,9,Raises [Attack]{mechanic:attack} one stage upon KOing a Pokémon.,"This Pokémon's [Attack]{mechanic:attack} rises one stage upon knocking out another Pokémon, even a friendly Pokémon.

This ability does not take effect when the Pokémon indirectly causes another Pokémon to faint, e.g. through [poison]{mechanic:poison} or []{move:spikes}.

If this Pokémon knocks out a Pokémon with []{ability:mummy}, the former's ability will change without taking effect."
154,5,Augmente l'[Attaque]{mechanic:attack} d'un niveau en subissant des dégâts d'une capacité []{type:dark}.,"Quand une capacité de type []{type:dark} frappe ce Pokémon, son [Attaque]{mechanic:attack} augmente d’un [niveau]{mechanic:stat-modifier}.

La capacité n’est en aucun cas annulée."
154,6,"Erhöht den []{mechanic:attack} um 1 [Stufe]{mechanic:stat-modifier}, wenn es von []{type:dark} Attacken getroffen wird.","Wenn ein Pokémon mit dieser Fähigkeit von einer []{type:dark} Attacke getroffen wird, wird sein []{mechanic:attack} um 1 [Stufe]{mechanic:stat-modifier} erhöht.

Die Attacke wird nicht beeinflusst."
154,9,Raises [Attack]{mechanic:attack} one stage upon taking damage from a []{type:dark} move.,"Whenever a []{type:dark}-type move hits this Pokémon, its [Attack]{mechanic:attack} rises one [stage]{mechanic:stat-modifier}.

The move is not negated in any way."
155,5,"Augmente la [Vitesse]{mechanic:speed} d'un [niveau]{mechanic:stat-modifier} en étant frappé par une capacité []{type:dark}, []{type:ghost}, ou []{type:bug}.","La [Vitesse]{mechanic:speed} de ce Pokémon augmente d'un niveau avec chaque frappe d'une capacité offensive de type []{type:dark}, []{type:ghost}, ou []{type:bug}."
155,6,"Erhöht die []{mechanic:speed} um 1 [Stufe]{mechanic:stat-modifier}, wenn es von []{type:dark}, []{type:ghost} oder []{type:bug} Attacken getroffen wird.","Die []{mechanic:speed} erhöht sich mit jedem Treffer einer []{type:dark}, []{type:ghost} oder []{type:bug} Attacke um 1 [Stufe]{mechanic:stat-modifier}."
155,9,"Raises [Speed]{mechanic:speed} one [stage]{mechanic:stat-modifier} upon being hit by a []{type:dark}, []{type:ghost}, or []{type:bug} move.","This Pokémon's [Speed]{mechanic:speed} rises one stage with each hit from a damaging []{type:dark}-, []{type:ghost}-, or []{type:bug}-type move."
156,5,Renvoie la plupart des capacités non offensives à leur lanceur.,"Quand ce Pokémon est ciblé par une capacité marquée comme étant réflechissable, la capacité est redirigée sur son lanceur.

Toutes les capacités réflechissables sont non offensives, et la plupart des capacités non offensives qui ciblent d’autres Pokémon sont réflechissables.

Un capacité réflechie par ce talent ou []{move:magic-coat} ne peut pas être réflechie à nouveau."
156,6,Reflektiert die meisten Attacken ohne Schaden zum Angreifer zurück.,"Wenn ein Pokémon mit dieser Fähigkeit von einer Attacke getroffen wird die als Reflektierbar gekennzeichnet ist, wird die Attacke zum Angreifer zurückgeworfen.

Alle reflektierbaren Attacken verursachen keinen Schaden und die meisten Attacken die keinen Schaden verursachen sind als reflektierbar gekennzeichnet.

Eine Attacke die von dieser Fähigkeit oder von []{move:magic-coat} reflektiert wurde, kann nicht zurückreflektiert werden."
156,9,Reflects most non-damaging moves back at their user.,"When this Pokémon is targeted by a move flagged as being reflectable, the move is redirected to its user.

All reflectable moves are non-damaging, and most non-damaging moves that target other Pokémon are reflectable.

A move reflected by this ability or []{move:magic-coat} cannot be reflected back."
157,5,"Absorbe les capacités []{type:grass}, augmentant l'[Attaque]{mechanic:attack} d'un [niveau]{mechanic:stat-modifier}.","Quand une capacité de type []{type:grass} frappe ce Pokémon, son [Attaque]{mechanic:attack} augmente d'un [niveau]{mechanic:stat-modifier}, annulant n'importe quel autre effet sur lui."
157,6,Absorbiert []{type:grass} Attacken und erhöhrt dabei den []{mechanic:attack} um 1 [Stufe]{mechanic:stat-modifier}.,"Wenn ein Pokémon mit dieser Fähigkeit von einer []{type:grass} Attacke getroffen wird, steigt sein []{mechanic:attack} um 1 [Stufe]{mechanic:stat-modifier}, wobei jeder andere Effekt entfernt wird."
157,9,"Absorbs []{type:grass} moves, raising [Attack]{mechanic:attack} one [stage]{mechanic:stat-modifier}.","Whenever a []{type:grass}-type move hits this Pokémon, its [Attack]{mechanic:attack} rises one [stage]{mechanic:stat-modifier}, negating any other effect on it."
158,5,Augmente la priorité des capacités non offensives d'un niveau.,Les capacités non offensives de ce Pokémon ont leur priorité augmentées d'un niveau.
158,6,Erhöht die []{mechanic:priority} von Attacken ohne Schaden um 1 Stufe.,"Wenn ein Pokémon diese Fähigkeit hat, erhöht sich die []{mechanic:priority} seiner Attacken die keinen Schaden anrichten um 1 Stufe."
158,9,Raises non-damaging moves' priority by one stage.,This Pokémon's non-damaging moves have their priority increased by one stage.
159,5,"Renforce les capacités []{type:rock}, []{type:ground}, et []{type:steel} d'1.3× leur puissance sous une [tempête de sable]{mechanic:sandstorm}.  Protège contre les dégâts de la tempête de sable.","Pendant une [tempête de sable]{mechanic:sandstorm}, les capacités de type []{type:rock}, []{type:ground}, et []{type:steel} de ce Pokémon ont 1.3× leur puissance de base.  Ce Pokémon ne subit pas les dégâts de la tempête de sable, peu importe son type."
159,6,"Verstärkt []{type:rock}, []{type:ground} und []{type:steel} Attacken um 30% während eines [Sandsturms]{mechanic:sandstorm}. Schützt vor Schäden durch [Sandstürme]{mechanic:sandstorm}.","Die []{type:rock}, []{type:ground} und []{type:steel} Attacken von Pokémon mit dieser Fähigkeit haben während eines [Sandsturms]{mechanic:sandstorm} 1,3× so viel Basisstärke wie sonst. Das Pokémon erleidet keinen Schaden durch [Sandstürme]{mechanic:sandstorm}, unabhängig von seinem Typ."
159,9,"Strengthens []{type:rock}, []{type:ground}, and []{type:steel} moves to 1.3× their power during a [sandstorm]{mechanic:sandstorm}.  Protects against sandstorm damage.","During a [sandstorm]{mechanic:sandstorm}, this Pokémon's []{type:rock}-, []{type:ground}-, and []{type:steel}-type moves have 1.3× their base power.  This Pokémon does not take sandstorm damage, regardless of type."
160,5,Inflige des dégâts au Pokémon attaquant d'1/8 de ses [PV]{mechanic:hp} max en cas de contact.,"Quand une capacité réalise un contact avec ce Pokémon, le lanceur de la capacité subit 1/8 de ses [PV]{mechanic:hp} maximum en dégâts.

Ce talent fonctionne de la même manière que []{ability:rough-skin}."
160,6,Angreifer erleiden bei Kontakt 1/8 ihrer max []{mechanic:hp} Schaden.,"Wenn ein Pokémon mit dieser Fähigkeit von einer Attacke mit Kontakt getroffen wird, erleidet der Angreifer 1/8 seiner maximalen []{mechanic:hp} Schaden.

Diese Fähigkeit ist identisch mit []{ability:rough-skin}."
160,9,Damages attacking Pokémon for 1/8 their max [HP]{mechanic:hp} on contact.,"Whenever a move makes contact with this Pokémon, the move's user takes 1/8 of its maximum [HP]{mechanic:hp} in damage.

This ability functions identically to []{ability:rough-skin}."
161,5,"Change la forme de []{pokemon:darmanitan} après chaque tour selon ses [PV]{mechanic:hp}: Mode Transe sous 50% de PV max, et Mode Normal sinon.","Ce Pokémon permute entre le Mode Normal et Mode Transe après chaque tour selon ses [PV]{mechanic:hp}.  Sous 50% de ses PV maximum, il change en Mode Transe, et à 50% ou au dessus, il change en Mode Normal.

Ce Pokémon retourne en Mode Normal en quittant le combat ou perdant son talent.  Ce talent n’a pas d’effet si ce Pokémon n’est pas un []{pokemon:darmanitan}."
161,6,"Ändert jede Runde die Form von []{pokemon:darmanitan} abhängig von seinen []{mechanic:hp}: Zen Modus bei weniger als 50% der max []{mechanic:hp}, ansonsten Standard Modus.","[]{pokemon:darmanitan} wechselt am Ende jeder Runde zwischen dem Standard Modus und dem Zen Modus, abhängig von seinen []{mechanic:hp}. Wenn es weniger als 50% seiner maximalen []{mechanic:hp} hat, wechselt es zum Zen Modus, bei 50% oder mehr zum Standard Modus.

[]{pokemon:darmanitan} wechselt zum Standard Modus beim Beenden des Kampfes oder wenn es die Fähigkeit verliert. Die Fähigkeit hat keinen Effekt für Pokémon außer []{pokemon:darmanitan}."
161,9,"Changes []{pokemon:darmanitan}'s form after each turn depending on its [HP]{mechanic:hp}: Zen Mode below 50% max HP, and Standard Mode otherwise.","This Pokémon switches between Standard Mode and Zen Mode after each turn depending on its [HP]{mechanic:hp}.  Below 50% of its maximum HP, it switches to Zen Mode, and at 50% or above, it switches to Standard Mode.

This Pokémon returns to Standard Mode upon leaving battle or losing this ability.  This ability has no effect if this Pokémon is not a []{pokemon:darmanitan}."
162,5,Augmente la précision des capacités d'1.1× pour les Pokémon alliés.,"Toutes les capacités des Pokémon alliés, incluant les propres capacités de ce Pokémon, ont 1.1× leur précision habituelle tant que ce Pokémon est au combat."
162,6,Erhöht die []{mechanic:accuracy} von Partnern um 10%.,"Die []{mechanic:accuracy} der Attacken von Pokémon ist 1,1× so hoch wie sonst, solange ein Pokémon mit dieser Fähigkeit im Team ist."
162,9,Increases moves' accuracy to 1.1× for friendly Pokémon.,"All friendly Pokémon's moves, including this Pokémon's own moves, have 1.1× their usual accuracy while this Pokémon is in battle."
163,5,Outrepasse les talents des cibles si elles peuvent entraver ou empêcher une capacité.,"Les capacités de ce Pokémon ignorent complètement les talents qui peuvent entraver ou empêcher leur effet sur la cible.

Par exemple, les capacités de ce Pokémon ignorent les talents qui les annuleraient totalement, tels que []{ability:water-absorb}; les talents qui empêcheraient n’importe lequel de ses effets, tels que []{ability:clear-body}, []{ability:shell-armor}, ou []{ability:sticky-hold}; et les talents qui garantissent n’importe quel bénéfice de protection générale, tels que []{ability:simple}, []{ability:snow-cloak}, ou []{ability:thick-fat}.  Si un talent peut entraver ou aider les capacités de ce Pokémon, e.g. []{ability:dry-skin} ou []{ability:unaware}, le talent est ignoré dans les deux cas.

Les talents qui ne correspondent pas à cette description, même s’ils peuvent entraver des capacités d’une autre manière quelconque, ne sont pas affectés.  Par exemple, []{ability:cursed-body} affecte seulement les potentielles prochaines utilisations de la capacité, tandis que []{ability:liquid-ooze} et []{ability:shadow-tag} peuvent seulement entraver l’effet d’une capacité sur le lanceur.  Ce talent ne peut pas ignorer les changements de type ou forme acquis par les talents, par exemple []{ability:color-change} ou []{ability:forecast}; ni les effets qui ont été causés par des talents mais qui ne sont plus liés à un talent, tels que la pluie de []{ability:drizzle}.  Ce talent ne peut pas ignorer []{ability:multitype} du tout.

Un talent ignoré par ce talent est seulement annulé tant que la capacité est utilisée.  Par exemple, les capacités de ce Pokémon peuvent [paralyser]{mechanic:paralysis} un Pokémon avec []{ability:limber}, mais Échauffement s’activera et soignera la paralysie immédiatement après, et les []{move:spikes} de ce Pokémon ne sont pas affectés par ce talent après avoir été placés.

Quand ce Pokémon entre au combat, tous les dresseurs participants sont notifiés qu’il a ce talent.

Ce talent fonctionne de la même manière que []{ability:mold-breaker} et []{ability:teravolt}."
163,6,"Umgeht die gegnerische Fähigkeit, wenn sie eine Attacke verhindern kann.","Die Attacken von Pokémon mit dieser Fähigkeit ignorieren Fähigkeiten, die die Attacke am Funktionieren hindern oder ihre Effekte beeinflussen.

Beispiel: Die Attacken ignorieren Fähigkeiten die sie komplett verhindern würden, wie []{ability:water-absorb}, Fähigkeiten die einen der Effekte verhindern würden, wie z.B. []{ability:clear-body}, []{ability:shell-armor} oder []{ability:sticky-hold} und Fähigkeiten die einen generellen schützenden Vorteil brächten, wie []{ability:simple}, []{ability:snow-cloak} oder []{ability:thick-fat}. Wenn eine Fähigkeit die Attacke behindern oder ihr helfen würde, wie []{ability:dry-skin} oder []{ability:unaware}, wird sie ebenfalls ignoriert.

Fähigkeiten die dieser Beschreibung nicht entsprechen, selbst wenn sie eine Attacke behindern könnten, werden nicht verhindert. Zum Beispiel beeinflusst []{ability:cursed-body} nur mögliche zukünftige Anwendungen der Attacke, während []{ability:liquid-ooze} und []{ability:shadow-tag} nur den Effekt der Attacke auf den Anwender verhindern. Die Attacke kann keine Typ- oder Form-Änderungen verhindern die durch Fähigkeiten ausgelöst werden, zum Beispiel []{ability:color-change} oder []{ability:forecast}, genauso wie Effekte die von Fähigkeiten verursacht wurden aber nicht mehr an die Fähigkeit gebunden sind, so wie der []{mechanic:rain} von []{ability:drizzle}. Die Fähigkeit kann []{ability:multitype} nicht verhindern.

Eine Fähigkeit die von dieser Fähigkeit ignoriert wird, wird nur überbrückt, während die Attacke eingesetzt wird. Beispiel: Die Attacken von Pokémon mit dieser Fähigkeit können ein Pokémon mit []{ability:limber} [paralysieren]{mechanic:paralysis} aber []{ability:limber} wird sich aktivieren und die Paralyse direkt danach heilen. Außerdem werden die [Stacheln]{move:spikes} dieses Pokémons nicht von dieser Fähigkeit beeinflusst, nachdem sie platziert wurden.

Wenn ein Pokémon mit dieser Fähigkeit den Kampf betritt, werden alle Trainer über diese Fähigkeit benachrichtigt.

Die Fähigkeit ist identisch mit []{ability:teravolt} und []{ability:mold-breaker}."
163,9,Bypasses targets' abilities if they could hinder or prevent moves.,"This Pokémon's moves completely ignore abilities that could hinder or prevent their effect on the target.

For example, this Pokémon's moves ignore abilities that would fully negate them, such as []{ability:water-absorb}; abilities that would prevent any of their effects, such as []{ability:clear-body}, []{ability:shell-armor}, or []{ability:sticky-hold}; and abilities that grant any general protective benefit, such as []{ability:simple}, []{ability:snow-cloak}, or []{ability:thick-fat}.  If an ability could either hinder or help this Pokémon's moves, e.g. []{ability:dry-skin} or []{ability:unaware}, the ability is ignored either way.

Abilities that do not fit this description, even if they could hinder moves in some other way, are not affected.  For example, []{ability:cursed-body} only affects potential future uses of the move, while []{ability:liquid-ooze} and []{ability:shadow-tag} can only hinder a move's effect on the user.  This ablity cannot ignore type or form changes granted by abilities, for example []{ability:color-change} or []{ability:forecast}; nor effects that were caused by abilities but are no longer tied to an ability, such as the rain from []{ability:drizzle}.  This ability cannot ignore []{ability:multitype} at all.

An ability ignored by this ability is only nullified while the move is being used.  For example, this Pokémon's moves can [paralyze]{mechanic:paralysis} a Pokémon with []{ability:limber}, but Limber will activate and heal the paralysis immediately thereafter, and this Pokémon's []{move:spikes} are not affected by this ability after they have been placed.

When this Pokémon enters battle, all participating trainers are notified that it has this ability.

This ability functions identically to []{ability:mold-breaker} and []{ability:teravolt}."
164,5,Outrepasse les talents des cibles si elles peuvent entraver ou empêcher une capacité.,"Les capacités de ce Pokémon ignorent complètement les talents qui peuvent entraver ou empêcher leur effet sur la cible.

Par exemple, les capacités de ce Pokémon ignorent les talents qui les annuleraient totalement, tels que []{ability:water-absorb}; les talents qui empêcheraient n’importe lequel de ses effets, tels que []{ability:clear-body}, []{ability:shell-armor}, ou []{ability:sticky-hold}; et les talents qui garantissent n’importe quel bénéfice de protection générale, tels que []{ability:simple}, []{ability:snow-cloak}, ou []{ability:thick-fat}.  Si un talent peut entraver ou aider les capacités de ce Pokémon, e.g. []{ability:dry-skin} ou []{ability:unaware}, le talent est ignoré dans les deux cas.

Les talents qui ne correspondent pas à cette description, même s’ils peuvent entraver des capacités d’une autre manière quelconque, ne sont pas affectés.  Par exemple, []{ability:cursed-body} affecte seulement les potentielles prochaines utilisations de la capacité, tandis que []{ability:liquid-ooze} et []{ability:shadow-tag} peuvent seulement entraver l’effet d’une capacité sur le lanceur.  Ce talent ne peut pas ignorer les changements de type ou forme acquis par les talents, par exemple []{ability:color-change} ou []{ability:forecast}; ni les effets qui ont été causés par des talents mais qui ne sont plus liés à un talent, tels que la pluie de []{ability:drizzle}.  Ce talent ne peut pas ignorer []{ability:multitype} du tout.

Un talent ignoré par ce talent est seulement annulé tant que la capacité est utilisée.  Par exemple, les capacités de ce Pokémon peuvent [paralyser]{mechanic:paralysis} un Pokémon avec []{ability:limber}, mais Échauffement s’activera et soignera la paralysie immédiatement après, et les []{move:spikes} de ce Pokémon ne sont pas affectés par ce talent après avoir été placés.

Quand ce Pokémon entre au combat, tous les dresseurs participants sont notifiés qu’il a ce talent.

Ce talent fonctionne de la même manière que []{ability:mold-breaker} et []{ability:turboblaze}."
164,6,"Umgeht die gegnerische Fähigkeit, wenn sie eine Attacke verhindern kann.","Die Attacken von Pokémon mit dieser Fähigkeit ignorieren Fähigkeiten, die die Attacke am Funktionieren hindern oder ihre Effekte beeinflussen.

Beispiel: Die Attacken ignorieren Fähigkeiten die sie komplett verhindern würden, wie []{ability:water-absorb}, Fähigkeiten die einen der Effekte verhindern würden, wie z.B. []{ability:clear-body}, []{ability:shell-armor} oder []{ability:sticky-hold} und Fähigkeiten die einen generellen schützenden Vorteil brächten, wie []{ability:simple}, []{ability:snow-cloak} oder []{ability:thick-fat}. Wenn eine Fähigkeit die Attacke behindern oder ihr helfen würde, wie []{ability:dry-skin} oder []{ability:unaware}, wird sie ebenfalls ignoriert.

Fähigkeiten die dieser Beschreibung nicht entsprechen, selbst wenn sie eine Attacke behindern könnten, werden nicht verhindert. Zum Beispiel beeinflusst []{ability:cursed-body} nur mögliche zukünftige Anwendungen der Attacke, während []{ability:liquid-ooze} und []{ability:shadow-tag} nur den Effekt der Attacke auf den Anwender verhindern. Die Attacke kann keine Typ- oder Form-Änderungen verhindern die durch Fähigkeiten ausgelöst werden, zum Beispiel []{ability:color-change} oder []{ability:forecast}, genauso wie Effekte die von Fähigkeiten verursacht wurden aber nicht mehr an die Fähigkeit gebunden sind, so wie der []{mechanic:rain} von []{ability:drizzle}. Die Fähigkeit kann []{ability:multitype} nicht verhindern.

Eine Fähigkeit die von dieser Fähigkeit ignoriert wird, wird nur überbrückt, während die Attacke eingesetzt wird. Beispiel: Die Attacken von Pokémon mit dieser Fähigkeit können ein Pokémon mit []{ability:limber} [paralysieren]{mechanic:paralysis} aber []{ability:limber} wird sich aktivieren und die Paralyse direkt danach heilen. Außerdem werden die [Stacheln]{move:spikes} dieses Pokémons nicht von dieser Fähigkeit beeinflusst, nachdem sie platziert wurden.

Wenn ein Pokémon mit dieser Fähigkeit den Kampf betritt, werden alle Trainer über diese Fähigkeit benachrichtigt.

Die Fähigkeit ist identisch mit []{ability:mold-breaker} und []{ability:turboblaze}."
