ability_id,local_language_id,short_effect,effect
54,9,Skips every second turn.,"Every second turn on which this Pokémon should attempt to use a move, it will instead do nothing (""loaf around"").

Loafing around interrupts moves that take multiple turns the same way [paralysis]{mechanic:paralysis}, [flinching]{mechanic:flinching}, etc do.  Most such moves, for example []{move:bide} or []{move:rollout}, are simply cut off upon loafing around.  Attacks with a recharge turn, such as []{move:hyper-beam}, do not have to recharge; attacks with a preparation turn, such as []{move:fly}, do not end up being used.  Moves that are forced over multiple turns and keep going through failure, such as []{move:outrage}, []{move:uproar}, or any move forced by []{move:encore}, keep going as usual.

If this Pokémon is [confused]{mechanic:confusion}, its confusion is not checked when loafing around; the Pokémon cannot hurt itself, and its confusion does not end or come closer to ending.

If this Pokémon attempts to move but fails, e.g. because of [paralysis]{mechanic:paralysis} or []{move:gravity}, it still counts as having moved and will loaf around the next turn.  If it does not attempt to move, e.g. because it is [asleep]{mechanic:sleep} or [frozen]{mechanic:freezing}, whatever it would have done will be postponed until its next attempt; that is, it will either loaf around or move as usual, depending on what it last did.

This ability cannot be changed with []{move:worry-seed}, but it can be disabled with []{move:gastro-acid}, changed with []{move:role-play}, or traded away with []{move:skill-swap}."
55,5,"Renforce les capacités physiques pour augmenter les dégâts de 1.5×, mais diminue leur [précision]{mechanic:accuracy} de 0.8×.","Les capacités physiques de ce Pokémon font 1.5× plus de [dégâts réguliers]{mechanic:regular-damage}, mais ont 0.8× leur [précision]{mechanic:accuracy} habituelle.

Les capacités Spéciales ne sont pas affectées.  Les capacités qui ont des dégâts fixes, telles que []{move:seismic-toss}, ont leur précision affectée, mais pas leurs dégâts.

Monde extérieur: Si le Pokémon de tête a ce talent, les Pokémon de plus haut niveau ont leur taux de rencontre augmenté."
55,6,"Erhöht den Schaden von physischen Attacken um 50%, aber senkt ihre []{mechanic:accuracy} auf 80% ihres sonstigen Werts.","Physische Attacken von Pokémon mit dieser Fähigkeit verursachen 1,5× so viel [Schaden]{mechanic:regular-damage} wie sonst, haben dafür aber nur 80% ihrer normalen []{mechanic:accuracy}.

Spezialattacken werden nicht beeinflusst. Attacken die festen Schaden verursachen wie []{move:seismic-toss} haben ihren normalen Schaden aber die verringerte []{mechanic:accuracy}.

Außerhalb vom Kampf: Wenn ein Pokémon mit dieser Fähigkeit an erster Stelle im Team steht, tauchen Pokémon mit einem höheren Level häufiger auf."
55,9,"Strengthens physical moves to inflict 1.5× damage, but decreases their [accuracy]{mechanic:accuracy} to 0.8×.","This Pokémon's physical moves do 1.5× as much [regular damage]{mechanic:regular-damage}, but have 0.8× their usual [accuracy]{mechanic:accuracy}.

Special moves are unaffected.  Moves that do set damage, such as []{move:seismic-toss}, have their accuracy affected, but not their damage.

Overworld: If the lead Pokémon has this ability, higher-levelled Pokémon have their encounter rate increased."
56,5,A 30% de chances de [rendre amoureux]{mechanic:infatuation} le Pokémon attaquant lors d'un contact.,"Quand une capacité réalise un contact avec ce Pokémon, le lanceur de la capacité a 30% de chances d'être [amoureux]{mechanic:infatuation}.

Monde extérieur: Si le premier Pokémon de l'équipe a ce talent, n'importe quel Pokémon sauvage dont l'espèce peut être des deux genres a 2/3 de chances d'être du genre opposé, et 1/3 chances d'avoir un genre aléatoire comme d'habitude."
56,6,Bei Kontakt besteht eine 30% Chance beim Gegner [Anziehung]{mechanic:infatuation} auszulösen.,"Wenn ein Pokémon mit dieser Fähigkeit von einer Attacke mit Kontakt getroffen wird, besteht eine 30% Chance, dass beim Angreifer [Anziehung]{mechanic:infatuation} ausgelöst wird.

Außerhalb vom Kampf: Wenn ein Pokémon mit dieser Fähigkeit an erster Stelle im Team steht, besteht bei allen wilden Pokémon die beide Geschlechter haben können eine 2/3 Chance, vom anderen Geschlecht zu sein und eine 1/3 Chance ein zufälliges Geschlecht zu haben."
56,9,Has a 30% chance of [infatuating]{mechanic:infatuation} attacking Pokémon on contact.,"Whenever a move makes contact with this Pokémon, the move's user has a 30% chance of being [infatuated]{mechanic:infatuation}.

Overworld: If the first Pokémon in the party has this ability, any wild Pokémon whose species can be either gender has a 2/3 chance of being set to the opposite gender, and a 1/3 chance of having a random gender as usual."
57,5,Augmente l'[Attaque Spéciale]{mechanic:special-attack} d'1.5× quand un Pokémon allié a []{ability:plus} ou []{ability:minus}.,"Ce Pokémon a 1.5× son [Attaque Spéciale]{mechanic:special-attack} si n'importe quel Pokémon allié a []{ability:plus} ou []{ability:minus}.

Ce bonus ne compte pas comme une [modification de stat]{mechanic:stat-modifier}.  Si l'un des talents est désactivé par []{move:gastro-acid}, les deux perdent leur effet."
57,6,Erhöht den []{mechanic:special-attack} um 50% wenn ein Team-Pokémon []{ability:plus} oder []{ability:minus} hat.,"Pokémon mit dieser Fähigkeit haben einen 1,5× so hohen []{mechanic:special-attack} wenn ein Team-Pokémon die Fähigkeit []{ability:plus} oder []{ability:minus} hat.

Der Bonus zählt nicht als []{mechanic:stat-modifier}. Wenn eine der Fähigkeiten deaktiviert wird, z.B. von []{move:gastro-acid}, verlieren beide ihren Effekt."
57,9,Increases [Special Attack]{mechanic:special-attack} to 1.5× when a friendly Pokémon has []{ability:plus} or []{ability:minus}.,"This Pokémon has 1.5× its [Special Attack]{mechanic:special-attack} if any friendly Pokémon has []{ability:plus} or []{ability:minus}.

This bonus does not count as a [stat modifier]{mechanic:stat-modifier}.  If either ability is disabled by []{move:gastro-acid}, both lose their effect."
58,5,Augmente l'[Attaque Spéciale]{mechanic:special-attack} d'1.5× quand un Pokémon allié a []{ability:plus} ou []{ability:minus}.,"Ce Pokémon a 1.5× son [Attaque Spéciale]{mechanic:special-attack} si n'importe quel Pokémon allié a []{ability:plus} ou []{ability:minus}.

Ce bonus ne compte pas comme une [modification de stat]{mechanic:stat-modifier}.  Si l'un des talents est désactivé par []{move:gastro-acid}, les deux perdent leur effet."
58,6,Erhöht den []{mechanic:special-attack} um 50% wenn ein Team-Pokémon []{ability:plus} oder []{ability:minus} hat.,"Pokémon mit dieser Fähigkeit haben einen 1,5× so hohen []{mechanic:special-attack} wenn ein Team-Pokémon die Fähigkeit []{ability:plus} oder []{ability:minus} hat.

Der Bonus zählt nicht als []{mechanic:stat-modifier}. Wenn eine der Fähigkeiten deaktiviert wird, z.B. von []{move:gastro-acid}, verlieren beide ihren Effekt."
58,9,Increases [Special Attack]{mechanic:special-attack} to 1.5× when a friendly Pokémon has []{ability:plus} or []{ability:minus}.,"This Pokémon has 1.5× its [Special Attack]{mechanic:special-attack} if any friendly Pokémon has []{ability:plus} or []{ability:minus}.

This bonus does not count as a [stat modifier]{mechanic:stat-modifier}.  If either ability is disabled by []{move:gastro-acid}, both lose their effect."
59,5,Change le type et la forme de []{pokemon:castform} pour correspondre à la [météo]{mechanic:weather}.,"Sous [pluie]{mechanic:rain}, [soleil intense]{mechanic:strong-sunlight}, ou [grêle]{mechanic:hail}, le type de ce Pokémon change en []{type:water}, []{type:fire}, ou []{type:ice}, respectivement, et sa forme change pour correspondre.

Ce talent n'a pas d'effet sur un autre Pokémon que []{pokemon:castform}.

Si la [météo]{mechanic:weather} prend fin ou devient quoi que ce soit qui ne déclenche pas ce talent, ou un Pokémon avec []{ability:air-lock} ou []{ability:cloud-nine} entre au combat, le type et forme de ce Pokémon reviennent à leur état initial.  Si ce talent est perdu ou désactivé, ce Pokémon ne peut pas changer son type et forme actuels jusqu'à ce qu'il regagne ce talent."
59,6,Ändert den Typ von []{pokemon:castform} zu dem des [Wetters]{mechanic:weather}.,"Während es [regnet]{mechanic:rain}, [hagelt]{mechanic:hail} oder bei [starkem Sonnenlicht]{mechanic:strong-sunlight}, ändert sich der Typ des Pokémons zu []{type:water}, []{type:ice} oder []{type:fire}, respektive. Außerdem ändert sich seine Form entsprechend.

Die Fähigkeit hat keinen Effekt für jedes andere Pokémon außer []{pokemon:castform}.

Wenn das []{mechanic:weather} endet oder sich zu einem ändert welches diese Fähigkeit nicht beeinflusst, oder wenn ein Pokémon mit []{ability:air-lock} oder []{ability:cloud-nine} den Kampf betritt, werden Typ und Form auf den Normalwert zurückgesetzt. Wenn die Fähigkeit deaktiviert oder ausgetauscht wird, kann das Pokémon seine Form nicht ändern, bis es sie wiedererlangt."
59,9,Changes []{pokemon:castform}'s type and form to match the [weather]{mechanic:weather}.,"During [rain]{mechanic:rain}, [strong sunlight]{mechanic:strong-sunlight}, or [hail]{mechanic:hail}, this Pokémon's type changes to []{type:water}, []{type:fire}, or []{type:ice}, respectively, and its form changes to match.

This ability has no effect for any Pokémon other than []{pokemon:castform}.

If the [weather]{mechanic:weather} ends or becomes anything that does not trigger this ability, or a Pokémon with []{ability:air-lock} or []{ability:cloud-nine} enters battle, this Pokémon's type and form revert to their default.  If this ability is lost or disabled, this Pokémon cannot change its current type and form until it regains its ability."
60,5,Empêche un objet tenu d'être retiré par un autre Pokémon.,"L'objet tenu de ce Pokémon ne peut pas être supprimé par un autre Pokémon.

Les capacités offensives qui supprimeraient l'objet de ce Pokémon peuvent toujours infliger des dégâts contre ce Pokémon, e.g. []{move:knock-off} ou []{move:pluck}.  Ce Pokémon peut toujours utiliser des capacités qui impliquent la perte de son propre objet, e.g. []{move:fling} ou []{move:trick}.

Monde extérieur: Si le Pokémon de tête a ce talent, le taux de rencontre en pêchant est augmenté."
60,6,"Verhindert, dass ein getragenes Item von einem anderen Pokémon gestohlen werden kann.","Einem Pokémon mit dieser Fähigkeit kann ein getragenes Item nicht gestohlen werden.

Attacken die Schaden verursachen und Items entfernen verursachen immer noch Schaden, z.B. []{move:knock-off} oder []{move:pluck}. Das Pokémon kann trotzdem Attacken einsetzen die eigene Items entfernen, wie z.B. []{move:fling} oder []{move:trick}.

Außerhalb vom Kampf: Wenn ein Pokémon mit dieser Fähigkeit an erster Stelle im Team steht, erhöht sich die Erfolgsrate beim Angeln."
60,9,Prevents a held item from being removed by other Pokémon.,"This Pokémon's hold item cannot be removed by other Pokémon.

Damaging moves that would remove this Pokémon's item can still inflict damage against this Pokémon, e.g. []{move:knock-off} or []{move:pluck}.  This Pokémon can still use moves that involve the loss of its own item, e.g. []{move:fling} or []{move:trick}.

Overworld: If the lead Pokémon has this ability, the encounter rate while fishing is increased."
61,5,A 33% de chances de soigner n'importe quelle [altération majeure de statut]{mechanic:major-status-ailment} après chaque tour.,"Après chaque tour, ce Pokémon a 33% de chances d 'être soigné de n'importe quelle [altération majeure de statut]{mechanic:major-status-ailment}."
61,6,Nach jeder Runde besteht eine 33% Chance von einer bestehenden [Statusänderung]{mechanic:major-status-ailment} geheilt zu werden.,Pokémon mit dieser Fähigkeit haben am Ende jeder Runde eine 33% Chance von einer bestehenden []{mechanic:major-status-ailment} geheilt zu werden.
61,9,Has a 33% chance of curing any [major status ailment]{mechanic:major-status-ailment} after each turn.,"After each turn, this Pokémon has a 33% of being cured of any [major status ailment]{mechanic:major-status-ailment}."
62,5,Augmente l'[Attaque]{mechanic:attack} d'1.5× avec une [altération majeure de statut]{mechanic:major-status-ailment}.,"Quand ce Pokémon est [endormi]{mechanic:sleep}, [brûlé]{mechanic:burn}, [paralysé]{mechanic:paralysis}, ou [empoisonné]{mechanic:poison}, il a 1.5× son [Attaque]{mechanic:attack}.  Ce Pokémon n'est pas affecté par les baisses d'Attaque habituelles de la brûlure.

Ce bonus ne compte pas comme une [modification de stat]{mechanic:stat-modifier}."
62,6,Erhöht den []{mechanic:attack} um 50% wenn das Pokémon unter einer []{mechanic:major-status-ailment} leidet.,"Wenn ein Pokémon mit dieser Fähigkeit [schläft]{mechanic:sleep}, [brennt]{mechanic:burn}, [paralysiert]{mechanic:paralysis} oder [vergiftet]{mechanic:poison} ist, ist sein []{mechanic:attack} 1,5× so hoch wie sonst. Bei Verbrennung gibt es keine Halbierung des [Angriffs]{mechanic:attack}.

Der Bonus zählt nicht als [Statuswerte Änderung]{mechanic:stat-modifier}."
62,9,Increases [Attack]{mechanic:attack} to 1.5× with a [major status ailment]{mechanic:major-status-ailment}.,"Whenever this Pokémon is [asleep]{mechanic:sleep}, [burned]{mechanic:burn}, [paralyzed]{mechanic:paralysis}, or [poisoned]{mechanic:poison}, it has 1.5× its [Attack]{mechanic:attack}.  This Pokémon is not affected by the usual Attack cut from a burn.

This bonus does not count as a [stat modifier]{mechanic:stat-modifier}."
63,5,Augmente la [Défense]{mechanic:attack} d'1.5× avec une [altération majeure de statut]{mechanic:major-status-ailment}.,"Quand ce Pokémon a une [altération majeure de statut]{mechanic:major-status-ailment}, il a 1.5× sa [Défense]{mechanic:defense}.

Ce bonus ne compte pas comme une [modification de stat]{mechanic:stat-modifier}."
63,6,Erhöht die []{mechanic:defense} um 50% wenn das Pokémon unter einer []{mechanic:major-status-ailment} leidet.,"Wenn ein Pokémon mit dieser Fähigkeit unter einer []{mechanic:major-status-ailment} leidet, hat es eine 1,5× höhere []{mechanic:defense}.

Der Bonus zählt nicht als [Statuswerte Änderung]{mechanic:stat-modifier}."
63,9,Increases [Defense]{mechanic:defense} to 1.5× with a [major status ailment]{mechanic:major-status-ailment}.,"Whenever this Pokémon has a [major status ailment]{mechanic:major-status-ailment}, it has 1.5× its [Defense]{mechanic:defense}.

This bonus does not count as a [stat modifier]{mechanic:stat-modifier}."
64,5,Inflige des dégâts aux adversaires qui utilisent des capacités drainantes d'autant qu'elles soigneraient.,"Quand un Pokémon devrait se soigner après avoir frappé ce Pokémon avec une capacité de drainage comme []{move:absorb}, il perdrait autant de [PV]{mechanic:hp} qu'il devrait gagner à la place.

[]{move:dream-eater} n'est pas affecté."
64,6,"Gegnern die absorbierende Attacken einsetzen, wird Schaden in der Höhe zugefügt, die die Attacke geheilt hätte.","Wenn ein Pokémon mit dieser Fähigkeit von einer absorbierenden Attacke wie []{move:absorb} getroffen wird, erleidet der Gegner so viele []{mechanic:hp} Schaden wie ihn die Attacke geheilt hätte.

[]{move:dream-eater} ist davon nicht betroffen."
64,9,Damages opponents using leeching moves for as much as they would heal.,"Whenever a Pokémon would heal after hitting this Pokémon with a leeching move like []{move:absorb}, it instead loses as many [HP]{mechanic:hp} as it would usually gain.

[]{move:dream-eater} is unaffected."
65,5,Renforce les capacités []{type:grass} pour infliger 1.5× de dégâts à 1/3 des [PV]{mechanic:hp} max ou moins.,"Quand ce Pokémon a 1/3 de ses [PV]{mechanic:hp} restants ou moins, ses capacités de type []{type:grass} infligent 1.5× plus de [dégâts réguliers]{mechanic:regular-damage}."
65,6,Erhöht den Schaden von []{type:grass} Attacken um 50% wenn nur noch 1/3 der maximalen []{mechanic:hp} oder weniger übrig sind.,"Wenn ein Pokémon mit dieser Fähigkeit nur noch 1/3 seiner maximalen []{mechanic:hp} oder weniger hat, werden all seine []{type:grass} Attacken verstärkt, so dass sie 1,5× so viel []{mechanic:regular-damage} anrichten wie sonst."
65,9,Strengthens []{type:grass} moves to inflict 1.5× damage at 1/3 max [HP]{mechanic:hp} or less.,"When this Pokémon has 1/3 or less of its [HP]{mechanic:hp} remaining, its []{type:grass}-type moves inflict 1.5× as much [regular damage]{mechanic:regular-damage}."
66,5,Renforce les capacités []{type:fire} pour infliger 1.5× de dégâts à 1/3 des [PV]{mechanic:hp} max ou moins.,"Quand ce Pokémon a 1/3 de ses [PV]{mechanic:hp} restants ou moins, ses capacités de type []{type:fire} infligent 1.5× plus de [dégâts réguliers]{mechanic:regular-damage}."
66,6,Erhöht den Schaden von []{type:fire} Attacken um 50% wenn nur noch 1/3 der maximalen []{mechanic:hp} oder weniger übrig sind.,"Wenn ein Pokémon mit dieser Fähigkeit nur noch 1/3 seiner maximalen []{mechanic:hp} oder weniger hat, werden all seine []{type:fire} Attacken verstärkt, so dass sie 1,5× so viel []{mechanic:regular-damage} anrichten wie sonst."
66,9,Strengthens []{type:fire} moves to inflict 1.5× damage at 1/3 max [HP]{mechanic:hp} or less.,"When this Pokémon has 1/3 or less of its [HP]{mechanic:hp} remaining, its []{type:fire}-type moves inflict 1.5× as much [regular damage]{mechanic:regular-damage}."
67,5,Renforce les capacités []{type:water} pour infliger 1.5× de dégâts à 1/3 des [PV]{mechanic:hp} max ou moins.,"Quand ce Pokémon a 1/3 de ses [PV]{mechanic:hp} restants ou moins, ses capacités de type []{type:water} infligent 1.5× plus de [dégâts réguliers]{mechanic:regular-damage}."
67,6,Erhöht den Schaden von []{type:water} Attacken um 50% wenn nur noch 1/3 der maximalen []{mechanic:hp} oder weniger übrig sind.,"Wenn ein Pokémon mit dieser Fähigkeit nur noch 1/3 seiner maximalen []{mechanic:hp} oder weniger hat, werden all seine []{type:water} Attacken verstärkt, so dass sie 1,5× so viel []{mechanic:regular-damage} anrichten wie sonst."
67,9,Strengthens []{type:water} moves to inflict 1.5× damage at 1/3 max [HP]{mechanic:hp} or less.,"When this Pokémon has 1/3 or less of its [HP]{mechanic:hp} remaining, its []{type:water}-type moves inflict 1.5× as much [regular damage]{mechanic:regular-damage}."
68,5,Renforce les capacités []{type:bug} pour infliger 1.5× de dégâts à 1/3 des [PV]{mechanic:hp} max ou moins.,"Quand ce Pokémon a 1/3 de ses [PV]{mechanic:hp} restants ou moins, ses capacités de type []{type:bug} infligent 1.5× plus de [dégâts réguliers]{mechanic:regular-damage}.

Monde extérieur: Si le Pokémon de tête a ce talent, le taux de rencontre sauvage est augmenté."
68,6,Erhöht den Schaden von []{type:bug} Attacken um 50% wenn nur noch 1/3 der maximalen []{mechanic:hp} oder weniger übrig sind.,"Wenn ein Pokémon mit dieser Fähigkeit nur noch 1/3 seiner maximalen []{mechanic:hp} oder weniger hat, werden all seine []{type:bug} Attacken verstärkt, so dass sie 1,5× so viel []{mechanic:regular-damage} anrichten wie sonst.

Außerhalb vom Kampf: Wenn ein Pokémon mit dieser Fähigkeit an erster Stelle im Team steht, ist die Wahrscheinlichkeit einem wilden Pokémon zu begegnen doppelt so hoch wie normal."
68,9,Strengthens []{type:bug} moves to inflict 1.5× damage at 1/3 max [HP]{mechanic:hp} or less.,"When this Pokémon has 1/3 or less of its [HP]{mechanic:hp} remaining, its []{type:bug}-type moves inflict 1.5× as much [regular damage]{mechanic:regular-damage}.

Overworld: If the lead Pokémon has this ability, the wild encounter rate is increased."
69,5,Protège contre les contrecoups.,"Ce Pokémon ne reçoit pas de dégât de contrecoup de ses capacités à contrecoup.

Le contrecoup de []{move:struggle} n'est pas affecté.  Ce talent n'empêche pas les dommages d'écrasement d'échec avec []{move:jump-kick} ou []{move:high-jump-kick}."
69,6,Schützt vor Rückstoßschaden.,"Pokémon mit dieser Fähigkeit erhalten keinen Schaden vom Rückstoß diverser Attacken.

Der Rückstoß von []{move:struggle} wird nicht verhindert. Die Fähigkeit verhindert nicht den Schaden der vom Fehlschlag von []{move:jump-kick} oder []{move:high-jump-kick} verursacht wird."
69,9,Protects against recoil damage.,"This Pokémon does not receive recoil damage from its recoil moves.

[]{move:struggle}'s recoil is unaffected.  This ability does not prevent crash damage from missing with []{move:jump-kick} or []{move:high-jump-kick}."
70,5,Invoque le [soleil intense]{mechanic:strong-sunlight} qui dure indéfiniment en entrant au combat.,"La [météo]{mechanic:weather} change en [soleil intense]{mechanic:strong-sunlight} quand ce Pokémon entre au combat et ne prend pas fin à moins d'être annulé par une autre condition météo.

Si plusieurs Pokémon avec ce talent, []{ability:drizzle}, []{ability:sand-stream}, ou []{ability:snow-warning} sont envoyés en même temps, les talents s'activeront dans l'ordre des [Vitesses]{mechanic:speed}, respectant []{move:trick-room}.  Chaque météo de talent annulera la météo précédente, et seulement la météo invoquée par le plus lent des Pokémon restera."
70,6,Ändert beim Betreten des Kampfes das []{mechanic:weather} in [starkes Sonnenlicht]{mechanic:strong-sunlight}.,"Das []{mechanic:weather} ändert sich zu [starkem Sonnenlicht]{mechanic:strong-sunlight} wenn ein Pokémon mit dieser Fähigkeit den Kampf betritt. Dieser Effekt ist dauerhaft bis das []{mechanic:weather} geändert wird.

Wenn mehrere Pokémon mit dieser Fähigkeit, []{ability:drizzle}, []{ability:sand-stream} oder []{ability:snow-warning} zur selben Zeit den Kampf betreten, werden die Fähigkeiten nach Reihenfolge der []{mechanic:speed} der Pokémon ausgelöst, unter Berücksichtigung von []{move:trick-room}."
70,9,Summons [strong sunlight]{mechanic:strong-sunlight} that lasts indefinitely upon entering battle.,"The [weather]{mechanic:weather} changes to [strong sunlight]{mechanic:strong-sunlight} when this Pokémon enters battle and does not end unless cancelled by another weather condition.

If multiple Pokémon with this ability, []{ability:drizzle}, []{ability:sand-stream}, or []{ability:snow-warning} are sent out at the same time, the abilities will activate in order of [Speed]{mechanic:speed}, respecting []{move:trick-room}.  Each ability's weather will cancel the previous weather, and only the weather summoned by the slowest of the Pokémon will stay."
71,5,Empêche les adversaires de fuir ou se retirer.  Ne concerne pas les types []{type:flying} et les Pokémon dans les airs.,"Quand ce Pokémon est au combat, les Pokémon opposés ne peuvent pas fuir ou se retirer.  Les Pokémon de type []{type:flying} et les Pokémon dans les airs, e.g. dû à []{ability:levitate} ou []{move:magnet-rise}, ne sont pas affectés.

Les Pokémon avec []{ability:run-away} peuvent toujours fuir.  Les Pokémon peuvent toujours se retirer avec l'utilisation d'une capacité ou objet.

Monde extérieur: Si le Pokémon de tête a ce talent, le taux de rencontre sauvage est doublé."
71,6,"Verhindert, dass der Gegner flieht oder ausgetauscht wird wenn er nicht vom Typ []{type:flying} ist oder schwebt.","Wenn ein Pokémon mit dieser Fähigkeit im Kampf ist, kann der Gegner nicht fliehen oder ausgetauscht werden. []{type:flying} Pokémon und schwebende, z.B. durch []{ability:levitate} oder []{move:magnet-rise} sind nicht betroffen.

Pokémon mit []{ability:run-away} können trotzdem fliehen. Pokémon können mit bestimmten Items oder Attacken ausgetauscht werden.

Außerhalb vom Kampf: Wenn ein Pokémon mit dieser Fähigkeit an erster Stelle im Team steht, ist die Wahrscheinlichkeit einem wilden Pokémon zu begegnen doppelt so hoch wie normal."
71,9,Prevents opponents from fleeing or switching out.  Eluded by []{type:flying}-types and Pokémon in the air.,"While this Pokémon is in battle, opposing Pokémon cannot flee or switch out.  []{type:flying}-type Pokémon and Pokémon in the air, e.g. due to []{ability:levitate} or []{move:magnet-rise}, are unaffected.

Pokémon with []{ability:run-away} can still flee.  Pokémon can still switch out with the use of a move or item.

Overworld: If the lead Pokémon has this ability, the wild encounter rate is doubled."
72,5,Empêche le [sommeil]{mechanic:sleep}.,"Ce Pokémon ne peut pas être [endormi]{mechanic:sleep}.

Ceci provoque l'échec complet de []{move:rest}.  Si un Pokémon est endormi et acquiert ce talent, il se réveillera immédiatement; ceci inclut en regagnant un talent perdu en quittant le combat.

Ce talent fonctionne de la même manière que []{ability:insomnia} au combat.

Monde extérieur: Si le Pokémon de tête a ce talent, les Pokémon de plus haut niveau ont leur taux de rencontre augmenté."
72,6,Verhindert []{mechanic:sleep}.,"Ein Pokémon mit dieser Fähigkeit kann nicht [einschlafen]{mechanic:sleep}.

[]{move:rest} schlägt fehl. Wenn ein Pokémon [schläft]{mechanic:sleep} und diese Fähigkeit erhält, wacht es sofort auf. Das bezieht das Wiedererlangen dieser Fähigkeit nach dem Kampf mit ein.

Diese Fähigkeit ist identisch mit []{ability:insomnia}.

Außerhalb vom Kampf: Wenn ein Pokémon mit dieser Fähigkeit an erster Stelle im Team steht, tauchen Pokémon mit einem höheren Level häufiger auf."
