move_effect_id,local_language_id,short_effect,effect
1,9,Inflicts regular damage with no additional effect.,Inflicts [regular damage].
2,9,Puts the target to sleep.,Puts the target to [sleep].
3,9,Has a $effect_chance% chance to [poison] the target.,Inflicts [regular damage].  Has a $effect_chance% chance to [poison] the target.
4,9,Drains half the damage inflicted to heal the user.,Inflicts [regular damage].  [Drains] half the damage inflicted to heal the user.
5,9,Has a $effect_chance% chance to [burn] the target.,Inflicts [regular damage].  Has a $effect_chance% chance to [burn] the target.
6,9,Has a $effect_chance% chance to [freeze] the target.,Inflicts [regular damage].  Has a $effect_chance% chance to [freeze] the target.
7,9,Has a $effect_chance% chance to [paralyze] the target.,Inflicts [regular damage].  Has a $effect_chance% chance to [paralyze] the target.
8,9,User faints.,"User [faint], even if the attack [fail] or [miss].  Inflicts [regular damage]."
9,9,Only works on sleeping Pokémon.  Drains half the damage inflicted to heal the user.,[Fails] if not used on a [sleep] Pokémon.  Inflicts [regular damage].  [Drains] half the damage inflicted to heal the user.
10,9,Uses the target's last used move.,"Uses the last move targeted at the user by a Pokémon still on the [field].  A move counts as targeting the user even if it hit multiple Pokémon, as long as the user was one of them; however, moves targeting the [field] itself do not count.  If the user has not been targeted by an appropriate move since entering the [field], or if no Pokémon that targeted the user remains on the [field], this move will [fail].

Moves that [fail], [miss], had [no effect], or were [block] are still copied.

Assist moves, time-delayed moves, “meta” moves that operate on other moves/Pokémon/abilities, and some other special moves cannot be copied and are ignored; if the last move to hit the user was such a move, the previous move will be used instead.  The full list of ignored moves is: acupressure, assist, chatter, copycat, counter, curse, doom-desire, feint, focus-punch, future-sight, helping-hand, magic-coat, me-first, metronome, mimic, mirror-coat, mirror-move, nature-power, perish-song, psych-up, role-play, sketch, sleep-talk, snatch, spit-up, struggle, and transform.

This move cannot be selected by assist, metronome, or sleep-talk, nor forced by encore."
11,9,Raises the user's Attack by one stage.,Raises the user's [Attack] by one [stage].
12,9,Raises the user's Defense by one stage.,Raises the user's [Defense] by one [stage].
14,9,Raises the user's Special Attack by one stage.,Raises the user's [Special Attack] by one [stage].
17,9,Raises the user's evasion by one stage.,Raises the user's [evasion] by one [stage].
18,9,Never misses.,Inflicts [regular damage].  Ignores [accuracy] and [evasion] modifiers.
19,9,Lowers the target's Attack by one stage.,Lowers the target's [Attack] by one [stage].
20,9,Lowers the target's Defense by one stage.,Lowers the target's [Defense] by one [stage].
21,9,Lowers the target's Speed by one stage.,Lowers the target's [Speed] by one [stage].
24,9,Lowers the target's accuracy by one stage.,Lowers the target's [accuracy] by one [stage].
25,9,Lowers the target's evasion by one stage.,Lowers the target's [evasion] by one [stage].
26,9,"Resets all Pokémon's stats, accuracy, and evasion.","Removes [stat], [accuracy], and [evasion] modifiers from every Pokémon on the [field].

This does not count as a stat reduction for the purposes of clear-body or white-smoke."
27,9,"User waits for two turns, then hits back for twice the damage it took.","User waits for two turns.  On the second turn, the user inflicts twice the damage it accumulated on the last Pokémon to hit it.  Damage inflicted is [typeless].

This move cannot be selected by sleep-talk."
28,9,"Hits every turn for 2-3 turns, then confuses the user.","Inflicts [regular damage].  User is forced to attack with this move for 2–3 turns,selected at random.  After the last hit, the user becomes [confused].

safeguard does not protect against the [confusion] from this move."
29,9,Immediately ends wild battles.  Forces trainers to switch Pokémon.,"[Switch] the target out for another of its trainer's Pokémon selected at random.  Wild battles end immediately.

Doesn't affect Pokémon with suction-cups or under the effect of ingrain."
30,9,Hits 2-5 times in one turn.,"Inflicts [regular damage].  Hits 2–5 times in one turn.

Has a 3/8 chance each to hit 2 or 3 times, and a 1/8 chance each to hit 4 or 5 times.  Averages to 3 hits per use."
31,9,User's type changes to the type of one of its moves at random.,"User's [type] changes to the [type] of one of its moves, selected at random.  hidden-power and weather-ball are treated as normal.  Only moves with a different [type] are eligible, and curse is never eligible.  If the user has no suitable moves, this move will [fail]."
32,9,Has a $effect_chance% chance to make the target flinch.,Inflicts [regular damage].  Has a $effect_chance% chance to make the target flinch.
33,9,Heals the user by half its max HP.,Heals the user for half its max [HP].
34,9,"Badly poisons the target, inflicting more damage every turn.",[Badly poisons] the target.  Never misses when used by a poison-type Pokémon.
35,9,Scatters money on the ground worth five times the user's level.,"Inflicts [regular damage].  After the battle ends, the winner receives five times the user's level in extra money for each time this move was used."
36,9,Reduces damage from special attacks by 50% for five turns.,"Erects a barrier around the user's side of the field that reduces damage from [special] attacks by half for five turns.  In double battles, the reduction is 1/3.  [Critical hit] are not affected by the barrier.

If the user is holding light-clay, the barrier lasts for eight turns.

brick-break or defog used by an opponent will destroy the barrier."
37,9,"Has a $effect_chance% chance to [burn], [freeze], or [paralyze] the target.","Inflicts [regular damage].  Has a $effect_chance% chance to [burn], [freeze], or [paralyze] the target.  One of these effects is selected at random; they do not each have independent chances to occur."
38,9,"User sleeps for two turns, completely healing itself.","User falls to [sleep] and immediately regains all its [HP].  If the user has another [major status effect]-effect, [sleep] will replace it.  The user will always wake up after two turns, or one turn with early-bird.

This move [fail] if the Pokémon cannot fall asleep due to uproar, insomnia, or vital-spirit.  It also fails if the Pokémon is at full health or is already asleep."
39,9,Causes a one-hit KO.,"Inflicts damage equal to the target's max [HP].  Ignores [accuracy] and [evasion] modifiers.  This move's [accuracy] is 30% plus 1% for each level the user is higher than the target.  If the user is a lower level than the target, this move will [fail].

Because this move inflicts a specific and finite amount of damage, endure still prevents the target from fainting.

The effects of lock-on, mind-reader, and no-guard still apply, as long as the user is equal or higher level than the target.  However, they will not give this move a chance to break through detect or protect."
40,9,Requires a turn to charge before attacking.,"Inflicts [regular damage].  User's [critical hit] rate is one level higher when using this move.  User charges for one turn before attacking.

This move cannot be selected by sleep-talk."
41,9,Inflicts damage equal to half the target's HP.,Inflicts [typeless] damage equal to half the target's remaining [HP].
42,9,Inflicts 40 points of damage.,Inflicts exactly 40 damage.
43,9,Prevents the target from fleeing and inflicts damage for 2-5 turns.,"Inflicts [regular damage].  For the next 2–5 turns, the target cannot leave the field and is damaged for 1/16 its max HP at the end of each turn.  The user continues to use other moves during this time.  If the user leaves the [field], this effect ends.

Has a 3/8 chance each to hit 2 or 3 times, and a 1/8 chance each to hit 4 or 5 times.  Averages to 3 hits per use.

rapid-spin cancels this effect."
44,9,Has an increased chance for a critical hit.,Inflicts [regular damage].  User's [critical hit] rate is one level higher when using this move.
45,9,Hits twice in one turn.,Inflicts [regular damage].  Hits twice in one turn.
46,9,"If the user misses, it takes half the damage it would have inflicted in recoil.","Inflicts [regular damage].  If this move misses, is blocked by protect or detect, or has no effect, the user takes half the damage it would have inflicted in recoil.  This recoil damage will not exceed half the user's max HP.

This move cannot be used while gravity is in effect."
47,9,Protects the user's stats from being changed by enemy moves.,"Pokémon on the user's side of the [field] are immune to stat-lowering effects for five turns.

guard-swap, heart-swap, and power-swap may still be used.

defog used by an opponent will end this effect."
48,9,Increases the user's chance to score a critical hit.,"User's [critical hit] rate is two levels higher until it leaves the field.  If the user has already used focus-energy since entering the field, this move will [fail].

This effect is passed on by baton-pass."
49,9,User receives 1/4 the damage it inflicts in recoil.,Inflicts [regular damage].  User takes 1/4 the damage it inflicts in recoil.
50,9,Confuses the target.,[Confuse] the target.
51,9,Raises the user's Attack by two stages.,Raises the user's [Attack] by two [stages].
52,9,Raises the user's Defense by two stages.,Raises the user's [Defense] by two [stages].
53,9,Raises the user's Speed by two stages.,Raises the user's [Speed] by two [stages].
54,9,Raises the user's Special Attack by two stages.,Raises the user's [Special Attack] by two [stages].
55,9,Raises the user's Special Defense by two stages.,Raises the user's [Special Defense] by two [stages].
58,9,User becomes a copy of the target until it leaves battle.,"User copies the target's species, weight, type, [ability], [calculated stats] (except [HP]), and moves.  Copied moves will all have 5 [PP] remaining.  [IV] are copied for the purposes of hidden-power, but stats are not recalculated.

choice-band, choice-scarf, and choice-specs stay in effect, and the user must select a new move.

This move cannot be copied by mirror-move, nor forced by encore."
59,9,Lowers the target's Attack by two stages.,Lowers the target's [Attack] by two [stages].
60,9,Lowers the target's Defense by two stages.,Lowers the target's [Defense] by two [stages].
61,9,Lowers the target's Speed by two stages.,Lowers the target's [Speed] by two [stages].
63,9,Lowers the target's Special Defense by two stages.,Lowers the target's [Special Defense] by two [stages].
66,9,Reduces damage from physical attacks by half.,"Erects a barrier around the user's side of the field that reduces damage from [physical] attacks by half for five turns.  In double battles, the reduction is 1/3.  [Critical hit] are not affected by the barrier.

If the user is holding light-clay, the barrier lasts for eight turns.

brick-break or defog used by an opponent will destroy the barrier."
67,9,Poisons the target.,[Poisons] the target.
68,9,Paralyzes the target.,[Paralyzes] the target.
69,9,Has a $effect_chance% chance to lower the target's Attack by one stage.,Inflicts [regular damage].  Has a $effect_chance% chance to lower the target's [Attack] by one [stage].
70,9,Has a $effect_chance% chance to lower the target's Defense by one stage.,Inflicts [regular damage].  Has a $effect_chance% chance to lower the target's [Defense] by one [stage].
71,9,Has a $effect_chance% chance to lower the target's Speed by one stage.,Inflicts [regular damage].  Has a $effect_chance% chance to lower the target's [Speed] by one [stage].
72,9,Has a $effect_chance% chance to lower the target's Special Attack by one stage.,Inflicts [regular damage].  Has a $effect_chance% chance to lower the target's [Special Attack] by one [stage].
73,9,Has a $effect_chance% chance to lower the target's Special Defense by one stage.,Inflicts [regular damage].  Has a $effect_chance% chance to lower the target's [Special Defense] by one [stage].
74,9,Has a $effect_chance% chance to lower the target's accuracy by one stage.,Inflicts [regular damage].  Has a $effect_chance% chance to lower the target's [accuracy] by one [stage].
76,9,User charges for one turn before attacking.  Has a $effect_chance% chance to make the target flinch.,"Inflicts [regular damage].  User charges for one turn before attacking.  [Critical hit chance]-chance is one level higher than normal.  Has a $effect_chance% chance to make the target [flinch].

This move cannot be selected by sleep-talk."
77,9,Has a $effect_chance% chance to confuse the target.,Inflicts [regular damage].  Has a $effect_chance% chance to [confuse] the target.
78,9,Hits twice in the same turn.  Has a $effect_chance% chance to poison the target.,Inflicts [regular damage].  Hits twice in the same turn.  Has a $effect_chance% chance to [poison] the target.
79,9,Never misses.,Inflicts [regular damage].  Ignores [accuracy] and [evasion] modifiers.
80,9,"Transfers 1/4 of the user's max HP into a doll, protecting the user from further damage or status changes until it breaks.","Transfers 1/4 the user's max [HP] into a doll that absorbs damage and causes most negative move effects to [fail].  If the user leaves the [field], the doll will vanish.  If the user cannot pay the [HP] cost, this move will fail.

The doll takes damage as normal, using the user's stats and types, and will break when its [HP] reaches zero.  Self-inflicted damage from [confusion] or recoil is not absorbed.  Healing effects from opponents ignore the doll and heal the user as normal.  Moves that work based on the user's [HP] still do so; the doll's [HP] does not influence any move.

The doll will block [major status effect]-effects, [confusion], and [flinch].  The effects of smelling-salts and wake-up-slap do not trigger against a doll, even if the Pokémon behind the doll has the appropriate [major status effect]-effect.  Multi-turn trapping moves like wrap will hit the doll for their [regular damage], but the multi-turn trapping and damage effects will not activate.

Moves blocked or damage absorbed by the doll do not count as hitting the user or inflicting damage for any effects that respond to such, e.g., avalanche, counter, or a rowap-berry.  magic-coat still works as normal, even against moves the doll would block.  Opposing Pokémon that damage the doll with a leech move like absorb are healed as normal.

It will also block acupressure, block, the curse effect of curse, dream-eater, embargo, flatter, gastro-acid, grudge, heal-block, leech-seed, lock-on, mean-look, mimic, mind-reader, nightmare, pain-split, psycho-shift, spider-web, sketch, swagger, switcheroo, trick, worry-seed, and yawn.  A Pokémon affected by yawn before summoning the doll will still fall to [sleep].

The doll blocks intimidate, but all other abilities act as though the doll did not exist.  If the user has an ability that absorbs moves of a certain type for [HP] (such as volt-absorb absorbing thunder-wave), such moves will not be blocked.

life-orb and berries that cause [confusion] still work as normal, but their respective [HP] loss and [confusion] are absorbed/blocked by the doll.

The user is still vulnerable to damage inflicted when entering or leaving the [field], such as by pursuit or spikes; however, the doll will block the [poison] effect of toxic-spikes.

The doll is passed on by baton-pass.  It keeps its existing [HP], but uses the replacement Pokémon's stats and types for damage calculation.

All other effects work as normal."
81,9,User foregoes its next turn to recharge.,"Inflicts [regular damage].  User loses its next turn to ""recharge"", and cannot attack or [switch] out during that turn."
82,9,"If the user is hit after using this move, its Attack rises by one stage.","Inflicts [regular damage].  Every time the user is hit after it uses this move but before its next action, its [Attack] raises by one [stage]."
83,9,Copies the target's last used move.,"This move is replaced by the target's last successfully used move, and its PP changes to 5.  If the target hasn't used a move since entering the field, if it tried to use a move this turn and [failed], or if the user already knows the targeted move, this move will fail.  This effect vanishes when the user leaves the field.

If chatter, metronome, mimic, sketch, or struggle is selected, this move will [fail].

This move cannot be copied by mirror-move, nor selected by assist or metronome, nor forced by encore."
84,9,Randomly selects and uses any move in the game.,"Selects any move at random and uses it.  Moves the user already knows are not eligible.  Assist, meta, protection, and reflection moves are also not eligible; specifically, assist, chatter, copycat, counter, covet, destiny-bond, detect, endure, feint, focus-punch, follow-me, helping-hand, me-first, metronome, mimic, mirror-coat, mirror-move, protect, quick-guard, sketch, sleep-talk, snatch, struggle, switcheroo, thief, trick, and wide-guard will not be selected by this move.

This move cannot be copied by mimic or mirror-move, nor selected by assist, metronome, or sleep-talk."
85,9,"Seeds the target, stealing HP from it every turn.","Plants a seed on the target that [drains] 1/8 of its max [HP] at the end of every turn and heals the user for the amount taken.  Has no effect on grass Pokémon.  The seed remains until the target leaves the field.

The user takes damage instead of being healed if the target has liquid-ooze.

rapid-spin will remove this effect.

This effect is passed on by baton-pass."
86,9,Does nothing.,"Does nothing.

This move cannot be used while gravity is in effect."
87,9,Disables the target's last used move for 1-8 turns.,"Disables the target's last used move, preventing its use for 4–7 turns, selected at random, or until the target leaves the [field].  If the target hasn't used a move since entering the [field], if it tried to use a move this turn and [failed],  if its last used move has 0 PP remaining, or if it already has a move disabled, this move will fail."
88,9,Inflicts damage equal to the user's level.,"Inflicts damage equal to the user's level.  Type immunity applies, but other type effects are ignored."
89,9,Inflicts damage between 50% and 150% of the user's level.,"Inflicts [typeless] damage between 50% and 150% of the user's level, selected at random in increments of 10%."
90,9,Inflicts twice the damage the user received from the last physical hit it took.,"Targets the last opposing Pokémon to hit the user with a [physical] move this turn.  Inflicts twice the damage that move did to the user.  If there is no eligible target, this move will [fail].  Type immunity applies, but other type effects are ignored.

This move cannot be copied by mirror-move, nor selected by assist or metronome."
91,9,Forces the target to repeat its last used move every turn for 2 to 6 turns.,"The next 4–8 times (selected at random) the target attempts to move, it is forced to repeat its last used move.  If the selected move allows the trainer to select a target, an opponent will be selected at random each turn.  If the target is prevented from using the selected move by some other effect, struggle will be used instead.  This effect ends if the selected move runs out of [PP].

If the target hasn't used a move since entering the [field], if it tried to use a move this turn and [failed], if it does not know the selected move, or if the selected move has 0 [PP] remaining, this move will fail.  If the target's last used move was encore, mimic, mirror-move, sketch, struggle, or transform, this move will fail."
92,9,Sets the user's and targets's HP to the average of their current HP.,"Changes the user's and target's remaining [HP] to the average of their current remaining [HP].  Ignores [accuracy] and [evasion] modifiers.  This effect does not count as inflicting damage for other moves and effects that respond to damage taken.

This effect [fail] against a substitute."
93,9,Has a $effect_chance% chance to make the target flinch.  Only works if the user is sleeping.,Only usable if the user is [sleep].  Inflicts [regular damage].  Has a $effect_chance% chance to make the target flinch.
94,9,Changes the user's type to a random type either resistant or immune to the last move used against it.,"Changes the user's type to a type either resistant or immune to the last damaging move that hit it.  The new type is selected at random and cannot be a type the user already is.  If there is no eligible new type, this move will [fail]."
95,9,Ensures that the user's next move will hit the target.,"If the user targets the same target again before the end of the next turn, the move it uses is guaranteed to hit.  This move itself also ignores [accuracy] and [evasion] modifiers.

One-hit KO moves are also guaranteed to hit, as long as the user is equal or higher level than the target.  This effect also allows the user to hit Pokémon that are off the field due to moves such as dig or fly.

If the target uses detect or protect while under the effect of this move, the user is not guaranteed to hit, but has a (100 - accuracy)% chance to break through the protection.

This effect is passed on by baton-pass."
96,9,Permanently becomes the target's last used move.,"Permanently replaces itself with the target's last used move.  If that move is chatter or struggle, this move will [fail].

This move cannot be copied by mimic or mirror-move, nor selected by assist or metronome, nor forced by encore."
98,9,Randomly uses one of the user's other three moves.  Only works if the user is sleeping.,"Only usable if the user is [sleep].  Randomly selects and uses one of the user's other three moves.  Use of the selected move requires and costs 0 [PP].

This move will not select assist, bide, bounce, chatter, copycat, dig, dive, fly, focus-punch, me-first, metronome, mirror-move, shadow-force, skull-bash, sky-attack, sky-drop, sleep-talk, solar-beam, razor-wind, or uproar.

If the selected move requires a recharge turn—i.e., one of blast-burn, frenzy-plant, giga-impact, hydro-cannon, hyper-beam, roar-of-time, or rock-wrecker—and the user is still [sleep] next turn, then it's forced to use this move again and pay another [PP] for the recharge turn.

This move cannot be copied by mirror-move, nor selected by assist, metronome, or sleep-talk."
99,9,"If the user faints this turn, the target automatically will, too.","If the user [faints] before its next move, the Pokémon that [faint] it will automatically [faint].  End-of-turn damage is ignored.

This move cannot be selected by assist or metronome."
100,9,"Inflicts more damage when the user has less HP remaining, with a maximum of 200 power.","Inflicts [regular damage].  Power varies inversely with the user's proportional remaining [HP].

64 * current HP / max HP | Power
-----------------------: | ----:
 0– 1                    |  200
 2– 5                    |  150
 6–12                    |  100
13–21                    |   80
22–42                    |   40
43–64                    |   20
"
101,9,Lowers the PP of the target's last used move by 4.,"Lowers the PP of the target's last used move by 4.  If the target hasn't used a move since entering the [field], if it tried to use a move this turn and [failed], or if its last used move has 0 PP remaining, this move will fail."
102,9,Cannot lower the target's HP below 1.,Inflicts [regular damage].  Will not reduce the target's [HP] below 1.
103,9,Cures the entire party of major status effects.,Removes [major status effects]-effects and [confusion] from every Pokémon in the user's party.
104,9,Inflicts regular damage with no additional effect.,Inflicts [regular damage].
105,9,"Hits three times, increasing power by 100% with each successful hit.","Inflicts [regular damage].  Hits three times in the same turn.  The second hit has double power, and the third hit has triple power.  Each hit has a separate [accuracy] check, and this move stops if a hit misses.

skill-link does not apply."
106,9,Takes the target's item.,"Inflicts [regular damage].  If the target is holding an item and the user is not, the user will permanently take the item.  Damage is still inflicted if an item cannot be taken.

Pokémon with sticky-hold or multitype are immune to the item theft effect.

The target cannot recover its item with recycle.

This move cannot be selected by assist or metronome."
107,9,Prevents the target from leaving battle.,"The target cannot [switch out] normally.  Ignores [accuracy] and [evasion] modifiers.  This effect ends when the user leaves the [field].

The target may still escape by using baton-pass, u-turn, or a shed-shell.

Both the user and the target pass on this effect with baton-pass."
108,9,Target loses 1/4 its max HP every turn as long as it's asleep.,"Only works on [sleep] Pokémon.  Gives the target a nightmare, damaging it for 1/4 its max [HP] every turn.  If the target wakes up or leaves the [field], this effect ends."
109,9,Raises the user's evasion by two stages.,"Raises the user's [evasion] by two [stages].

stomp and steamroller have double power against Pokémon that have used this move since entering the [field]."
110,9,Ghosts pay half their max HP to hurt the target every turn.  Others decrease Speed but raise Attack and Defense.,"If the user is a ghost: user pays half its max [HP] to place a curse on the target, damaging it for 1/4 its max [HP] every turn.
Otherwise: Lowers the user's [Speed] by one [stage], and raises its [Attack] and [Defense] by one [stage] each.

The curse effect is passed on by baton-pass.

This move cannot be copied by mirror-move."
