move_effect_id,local_language_id,short_effect,effect
112,9,Prevents any moves from hitting the user this turn.,"No moves will hit the user for the remainder of this turn.  If the user is last to act this turn, this move will [fail].

If the user successfully used detect, endure, protect, quick-guard, or wide-guard on the last turn, this move has a 50% chance to [fail].

lock-on, mind-reader, and no-guard provide a (100 – accuracy)% chance for moves to break through this move.  This does not apply to one-hit KO moves (fissure, guillotine, horn-drill, and sheer-cold); those are always blocked by this move.

thunder during rain-dance and blizzard during hail have a 30% chance to break through this move.

The following effects are not prevented by this move:

* acupressure from an ally
* curse's curse effect
* Delayed damage from doom-desire and future-sight; however, these moves will be prevented if they are used this turn
* feint, which will also end this move's protection after it hits
* imprison
* perish-song
* shadow-force
* Moves that merely copy the user, such as transform or psych-up

This move cannot be selected by assist or metronome."
113,9,"Scatters Spikes, hurting opposing Pokémon that switch in.","Scatters spikes around the opposing [field], which damage opposing Pokémon that enter the [field] for 1/8 of their max [HP].  Pokémon immune to ground moves are immune to this damage, except during gravity.  Up to three layers of spikes may be laid down, adding 1/16 to the damage done: two layers of spikes damage for 3/16 max [HP], and three layers damage for 1/4 max [HP].

wonder-guard does not block damage from this effect.

rapid-spin removes this effect from its user's side of the [field].  defog removes this effect from its target's side of the [field]."
114,9,"Forces the target to have no Evade, and allows it to be hit by Normal and Fighting moves even if it's a Ghost.",Resets the target's [evasion] to normal and prevents any further boosting until the target leaves the [field].  A ghost under this effect takes normal damage from normal and fighting moves.  This move itself ignores [accuracy] and [evasion] modifiers.
115,9,User and target both faint after three turns.,"Every Pokémon is given a counter that starts at 3 and decreases by 1 at the end of every turn, including this one.  When a Pokémon's counter reaches zero, that Pokémon [faint].  A Pokémon that leaves the [field] will lose its counter; its replacement does not inherit the effect, and other Pokémon's counters remain.

This effect is passed on by baton-pass.

This move cannot be copied by mirror-move."
116,9,Changes the weather to a sandstorm for five turns.,"Changes the weather to a sandstorm for five turns.  Pokémon that are not ground, rock, or steel take 1/16 their max [HP] at the end of every turn.  Every rock Pokémon's original [Special Defense] is raised by 50% for the duration of this effect.

solar-beam's power is halved.

moonlight, morning-sun, and synthesis only heal 1/4 the user's max [HP]."
117,9,Prevents the user's HP from lowering below 1 this turn.,"The user's [HP] cannot be lowered below 1 by any means for the remainder of this turn.

If the user successfully used detect, endure, protect, quick-guard, or wide-guard on the last turn, this move has a 50% chance to [fail].

This move cannot be selected by assist or metronome."
118,9,"Power doubles every turn this move is used in succession after the first, resetting after five turns.","Inflicts [regular damage].  User is forced to use this move for five turns.  Power doubles every time this move is used in succession to a maximum of 16x, and resets to normal after the lock-in ends.  If this move misses or becomes unusable, the lock-in ends.

If the user has used defense-curl since entering the field, this move has double power."
119,9,Raises the target's Attack by two stages and confuses the target.,"Raises the target's [Attack] by two [stages], then [confuses] it.  If the target's [Attack] cannot be [raised] by two [stages], the [confusion] is not applied."
120,9,"Power doubles every turn this move is used in succession after the first, maxing out after five turns.","Inflicts [regular damage].  Power doubles after every time this move is used, whether consecutively or not, maxing out at 16x.  If this move misses or the user leaves the [field], power resets."
121,9,"Target falls in love if it has the opposite gender, and has a 50% chance to refuse attacking the user.","Causes the target to fall in love with the user, giving it a 50% chance to do nothing each turn.  If the user and target are the same gender, or either is genderless, this move will [fail].  If either Pokémon leaves the [field], this effect ends."
122,9,"Power increases with happiness, up to a maximum of 102.","Inflicts [regular damage].  Power increases with [happiness], given by `happiness * 2 / 5`, to a maximum of 102.  Power bottoms out at 1."
123,9,Randomly inflicts damage with power from 40 to 120 or heals the target for 1/4 its max HP.,"Randomly uses one of the following effects.

Effect                                             | Chance
-------------------------------------------------- | -----:
Inflicts [regular damage] with 40 power  |    40%
Inflicts [regular damage] with 80 power  |    30%
Inflicts [regular damage] with 120 power |    10%
Heals the target for 1/4 its max [HP]    |    20%

On average, this move inflicts [regular damage] with 52 power and heals the target for 1/20 its max [HP]."
124,9,"Power increases as happiness decreases, up to a maximum of 102.","Inflicts [regular damage].  Power increases inversely with [happiness], given by `(255 - happiness) * 2 / 5`, to a maximum of 102.  Power bottoms out at 1."
125,9,Protects the user's field from major status ailments and confusion for five turns.,"Protects Pokémon on the user's side of the [field] from [major status] effects and [confusion] for five turns.  Does not cancel existing ailments.  This effect remains even if the user leaves the [field].

If yawn is used while this move is in effect, it will immediately [fail].

defog used by an opponent will end this effect.

This effect does not prevent the [confusion] caused by outrage, petal-dance, or thrash."
126,9,Has a $effect_chance% chance to [burn] the target.  Lets frozen Pokémon thaw themselves.,"Inflicts [regular damage].  Has a $effect_chance% chance to [burn] the target.  [Frozen] Pokémon may use this move, in which case they will thaw."
127,9,Power varies randomly from 10 to 150.,"Inflicts [regular damage].  Power is selected at random between 10 and 150, with an average of 71:

Magnitude | Power | Chance
--------: | ----: | -----:
        4 |    10 |     5%
        5 |    30 |    10%
        6 |    50 |    20%
        7 |    70 |    30%
        8 |    90 |    20%
        9 |   110 |    10%
       10 |   150 |     5%

This move has double power against Pokémon currently underground due to dig."
128,9,Allows the trainer to switch out the user and pass effects along to its replacement.,"User [switches out], and the trainer selects a replacement Pokémon from the party.  [Stat] changes, [confusion], and persistent move effects are passed along to the replacement Pokémon.

The following move effects are passed:

* aqua-ring
* both the user's and target's effect of block, mean-look, and spider-web
* the curse effect of curse
* embargo
* focus-energy or an activated lansat-berry
* gastro-acid
* ingrain
* being sapped by leech-seed
* being targeted by lock-on or mind-reader
* magnet-rise
* perish-song's counter
* power-trick
* substitute; the doll's HP is unchanged

The replacement Pokémon does not trigger effects that respond to Pokémon switching in."
129,9,"Has double power against, and can hit, Pokémon attempting to switch out.","Inflicts [regular damage].  If the target attempts to [switch out] this turn before the user acts, this move hits the target before it leaves and has double power.

This effect can still hit a Pokémon that [switches out] when it has a substitute up or when an ally has used follow-me."
130,9,"Frees the user from binding moves, removes Leech Seed, and blows away Spikes.","Inflicts [regular damage].  Removes leech-seed from the user, frees the user from bind, clamp, fire-spin, magma-storm, sand-tomb, whirlpool, and wrap, and clears spikes, stealth-rock, and toxic-spikes from the user's side of the [field].  If this move misses or has [no effect], its effect doesn't activate."
131,9,Inflicts 20 points of damage.,Inflicts exactly 20 damage.
133,9,Heals the user by half its max HP.  Affected by weather.,"Heals the user for half its max [HP].

During sunny-day, the healing is increased to 2/3 max [HP].

During hail, rain-dance, or sandstorm, the healing is decreased to 1/4 max [HP]."
136,9,Power and type depend upon user's IVs.  Power can range from 30 to 70.,"Inflicts [regular damage].  Power and type are determined by the user's [IV].

Power is given by `x * 40 / 63 + 30`.  `x` is obtained by arranging bit 1 from the [IV] for each of [Special Defense], [Special Attack], [Speed], [Defense], [Attack], and [HP] in that order.  (Bit 1 is 1 if the [IV] is of the form `4n + 2` or `4n + 3`.  `x` is then 64 * [Special Defense] [IV] bit 1, plus 32 * [Special Attack] [IV] bit 1, etc.)

Power is always between 30 and 70, inclusive.  Average power is 49.5.

Type is given by `y * 15 / 63`, where `y` is similar to `x` above, except constructed from bit 0.  (Bit 0 is 1 if the [IV] is odd.)  The result is looked up in the following table.

Value | Type
----: | --------
    0 | fighting
    1 | flying
    2 | poison
    3 | ground
    4 | rock
    5 | bug
    6 | ghost
    7 | steel
    8 | fire
    9 | water
   10 | grass
   11 | electric
   12 | psychic
   13 | ice
   14 | dragon
   15 | dark

This move thus cannot be normal.  Most other types have an equal 1/16 chance to be selected, given random [IV].  However, due to the flooring used here, bug, fighting, and grass appear 5/64 of the time, and dark only 1/64 of the time."
137,9,Changes the weather to rain for five turns.,"Changes the weather to rain for five turns, during which water moves inflict 50% extra damage, and fire moves inflict half damage.

If the user is holding damp-rock, this effect lasts for eight turns.

thunder has 100% accuracy.  If the target has used detect or protect, thunder has a (100 - accuracy)% chance to break through the protection.

solar-beam has half power.

moonlight, morning-sun, and synthesis heal only 1/4 of the user's max [HP].

Pokémon with swift-swim have doubled original [Speed].

Pokémon with forecast become water.

Pokémon with dry-skin heal 1/8 max [HP], Pokémon with hydration are cured of [major status effects]-effects, and Pokémon with rain-dish heal 1/16 max [HP] at the end of each turn."
138,9,Changes the weather to sunny for five turns.,"Changes the weather to sunshine for five turns, during which fire moves inflict 50% extra damage, and water moves inflict half damage.

If the user is holding heat-rock, this effect lasts for eight turns.

Pokémon cannot become [frozen].

thunder has 50% accuracy.

solar-beam skips its charge turn.

moonlight, morning-sun, and synthesis heal 2/3 of the user's max [HP].

Pokémon with chlorophyll have doubled original [Speed].

Pokémon with forecast become fire.

Pokémon with leaf-guard are not affected by [major status effects]-effects.

Pokémon with flower-gift change form; every Pokémon on their side of the [field] have their original [Attack] and [Special Attack] increased by 50%.

Pokémon with dry-skin lose 1/8 max [HP] at the end of each turn.

Pokémon with solar-power have their original [Special Attack] raised by 50% but lose 1/8 their max [HP] at the end of each turn."
139,9,Has a $effect_chance% chance to raise the user's Defense by one stage.,Inflicts [regular damage]. Has a $effect_chance% chance to raise the user's [Defense] one [stage].
140,9,Has a $effect_chance% chance to raise the user's Attack by one stage.,Inflicts [regular damage]. Has a $effect_chance% chance to raise the user's [Attack] one [stage].
141,9,Has a $effect_chance% chance to raise all of the user's stats by one stage.,Inflicts [regular damage]. Has a $effect_chance% chance to raise all of the user's stats one [stage].
143,9,User pays half its max HP to max out its Attack.,"User pays half its max [HP] to raise its [Attack] to +6 [stages].  If the user cannot pay the [HP] cost, this move will [fail]."
144,9,Discards the user's stat changes and copies the target's.,"Discards the user's [stat changes] and copies the target's.

This move cannot be copied by mirror-move."
145,9,Inflicts twice the damage the user received from the last special hit it took.,"Targets the last opposing Pokémon to hit the user with a [special] move this turn.  Inflicts twice the damage that move did to the user.  If there is no eligible target, this move will [fail].  Type immunity applies, but other type effects are ignored.

This move cannot be copied by mirror-move, nor selected by assist or metronome."
146,9,Raises the user's Defense by one stage.  User charges for one turn before attacking.,"Inflicts [regular damage].  Raises the user's [Defense] by one [stage].  User then charges for one turn before attacking.

This move cannot be selected by sleep-talk."
147,9,Has a $effect_chance% chance to make the target flinch.,"Inflicts [regular damage].  Has a $effect_chance% chance to make each target [flinch].

If the target is under the effect of bounce, fly, or sky-drop, this move will hit with double power."
148,9,Inflicts regular damage and can hit Dig users.,"Inflicts [regular damage].

If the target is in the first turn of dig, this move will hit with double power."
149,9,Hits the target two turns later.,"Inflicts [typeless] [regular damage] at the end of the third turn, starting with this one.  This move cannot score a [critical hit].  If the target [switches out], its replacement will be hit instead.  Damage is calculated at the time this move is used; [stat changes] and [switching out] during the delay won't change the damage inflicted.  No move with this effect can be used against the same target again until after the end of the third turn.

This effect breaks through wonder-guard.

If the target is protected by protect or detect on the turn this move is used, this move will [fail].  However, the damage on the third turn will break through protection.

The damage is applied at the end of the turn, so it ignores endure and focus-sash.

This move cannot be copied by mirror-move."
150,9,Inflicts regular damage and can hit Pokémon in the air.,"Inflicts [regular damage].

If the target is under the effect of bounce, fly, or sky-drop, this move will hit with double power."
151,9,Has a $effect_chance% chance to make the target flinch.,"Inflicts [regular damage].  Has a $effect_chance% chance to make the target [flinch].

Power is doubled against Pokémon that have used minimize since entering the [field]."
152,9,Requires a turn to charge before attacking.,"Inflicts [regular damage].  User charges for one turn before attacking.

During sunny-day, the charge turn is skipped.

During hail, rain-dance, or sandstorm, power is halved.

This move cannot be selected by sleep-talk."
153,9,Has a $effect_chance% chance to paralyze the target.,"Inflicts [regular damage].  Has a $effect_chance% chance to [paralyze] the target.

During rain-dance, this move has 100% accuracy.  It also has a (100 - accuracy)% chance to break through the protection of protect and detect.

During sunny-day, this move has 50% accuracy."
154,9,Immediately ends wild battles.  No effect otherwise.,Does nothing.  Wild battles end immediately.
155,9,Hits once for every conscious Pokémon the trainer has.,"Inflicts [typeless] [regular damage].  Every Pokémon in the user's party, excepting those that have fainted or have a [major status effect]-effect, attacks the target.  Calculated stats are ignored; the base stats for the target and assorted attackers are used instead.  The random factor in the damage formula is not used.  dark Pokémon still get [STAB].

This effect breaks through wonder-guard."
156,9,"User flies high into the air, dodging all attacks, and hits next turn.","Inflicts [regular damage].  User flies high into the air for one turn, becoming immune to attack, and hits on the second turn.

During the immune turn, gust, hurricane, sky-uppercut, smack-down, thunder, twister, and whirlwind still hit the user normally.  gust and twister also have double power against the user.

The damage from hail and sandstorm still applies during the immune turn.

The user may be hit during its immune turn if under the effect of lock-on, mind-reader, or no-guard.

This move cannot be used while gravity is in effect.

This move cannot be selected by sleep-talk."
157,9,Raises user's Defense by one stage.,"Raises user's [Defense] by one [stage].

After this move is used, the power of ice-ball and rollout are doubled until the user leaves the [field]."
159,9,Can only be used as the first move after the user enters battle.  Causes the target to flinch.,Inflicts [regular damage].  Causes the target to flinch.  Can only be used on the user's first turn after entering the [field].
160,9,Forced to use this move for several turns.  Pokémon cannot fall asleep in that time.,"Inflicts [regular damage].  User is forced to use this move for 2–5 turns, selected at random.  All Pokémon on the [field] wake up, and none can fall to [sleep] until the lock-in ends.

Pokémon cannot use rest during this effect.

This move cannot be selected by sleep-talk."
161,9,Stores energy up to three times for use with Spit Up and Swallow.,"Raises the user's [Defense] and [Special Defense] by one [stage] each.  Stores energy for use with spit-up and swallow.  Up to three levels of energy can be stored, and all are lost if the user leaves the [field].  Energy is still stored even if the stat boosts cannot be applied.

If the user uses baton-pass, the stat boosts are passed as normal, but the stored energy is not."
162,9,Power is 100 times the amount of energy Stockpiled.,"Inflicts [regular damage].  Power is equal to 100 times the amount of energy stored by stockpile.  Ignores the random factor in the damage formula.  Stored energy is consumed, and the user's [Defense] and [Special Defense] are reset to what they would be if stockpile had not been used.  If the user has no energy stored, this move will [fail].

This move cannot be copied by mirror-move."
163,9,"Recovers 1/4 HP after one Stockpile, 1/2 HP after two Stockpiles, or full HP after three Stockpiles.","Heals the user depending on the amount of energy stored by stockpile: 1/4 its max [HP] after one use, 1/2 its max [HP] after two uses, or fully after three uses.  Stored energy is consumed, and the user's [Defense] and [Special Defense] are reset to what they would be if stockpile had not been used.  If the user has no energy stored, this move will [fail]."
165,9,Changes the weather to a hailstorm for five turns.,"Changes the weather to hail for five turns, during which non-ice Pokémon are damaged for 1/16 their max [HP] at the end of every turn.

If the user is holding icy-rock, this effect lasts for eight turns.

blizzard has 100% accuracy.  If the target has used detect or protect, blizzard has a (100 - accuracy)% chance to break through the protection.

moonlight, morning-sun, and synthesis heal only 1/4 of the user's max [HP].

Pokémon with snow-cloak are exempt from this effect's damage."
166,9,Prevents the target from using the same move twice in a row.,"Prevents the target from attempting to use the same move twice in a row.  When the target leaves the [field], this effect ends.

If the target is forced to attempt a repeated move due to choice-band, choice-scarf, choice-specs, disable, encore, taunt, only having [PP] remaining for one move, or any other effect, the target will use struggle instead.  The target is then free to use the forced move next turn, as it didn't use that move this turn."
167,9,Raises the target's Special Attack by one stage and confuses the target.,"Raises the target's [Special Attack] by one [stage], then [confuses] it."
168,9,Burns the target.,[Burns] the target.
169,9,Lowers the target's Attack and Special Attack by two stages.  User faints.,Lowers the target's [Attack] and [Special Attack] by two [stages].  User faints.
170,9,"Power doubles if user is burned, paralyzed, or poisoned.","Inflicts [regular damage].  If the user is [burned], [paralyzed], or [poisoned], this move has double power."
171,9,"If the user takes damage before attacking, the attack is canceled.","Inflicts [regular damage].  If the user takes damage this turn before hitting, this move will [fail].

This move cannot be copied by mirror-move, nor selected by assist, metronome, or sleep-talk."
172,9,"If the target is paralyzed, inflicts double damage and cures the paralysis.","Inflicts [regular damage].  If the target is [paralyzed], this move has double power, and the target is cured of its [paralysis]."
173,9,Redirects the target's single-target effects to the user for this turn.,"Until the end of this turn, any moves that opposing Pokémon target solely at the user's ally will instead target the user.  If both Pokémon on the same side of the [field] use this move on the same turn, the Pokémon that uses it last will become the target.

This effect takes priority over lightningrod and storm-drain.

If the user's ally [switches out], opposing Pokémon may still hit it with pursuit.

This move cannot be selected by assist or metronome."
174,9,Uses a move which depends upon the terrain.,"Uses another move chosen according to the terrain.

Terrain                   | Selected move
------------------------- | ------------------
Building                  | tri-attack
Cave                      | rock-slide
Deep water                | hydro-pump
Desert                    | earthquake
Grass                     | seed-bomb
Mountain                  | rock-slide
Road                      | earthquake
Shallow water             | hydro-pump
Snow                      | blizzard
Tall grass                | seed-bomb
electric-terrain | thunderbolt
grassy-terrain   | energy-ball
misty-terrain    | moonblast

In Pokémon Battle Revolution:

Terrain        | Selected move
-------------- | ------------------
Courtyard      | tri-attack
Crystal        | rock-slide
Gateway        | hydro-pump
Magma          | rock-slide
Main Street    | tri-attack
Neon           | tri-attack
Stargazer      | rock-slide
Sunny Park     | seed-bomb
Sunset         | earthquake
Waterfall      | seed-bomb

This move cannot be copied by mirror-move."
175,9,Raises the user's Special Defense by one stage.  User's Electric moves have doubled power next turn.,"Raises the user's [Special Defense] by one [stage].  If the user uses an electric move next turn, its power will be doubled."
176,9,"For the next few turns, the target can only use damaging moves.","Target is forced to only use damaging moves for the next 3–5 turns, selected at random.  Moves that select other moves not known in advance do not count as damaging.

assist, copycat, me-first, metronome, mirror-move, and sleep-talk do not directly inflict damage and thus may not be used.

bide, counter, endeavor, metal-burst, and mirror-coat are allowed."
177,9,Ally's next move inflicts half more damage.,"Boosts the power of the target's moves by 50% until the end of this turn.

This move cannot be copied by mirror-move, nor selected by assist or metronome."
178,9,User and target swap items.,"User and target permanently swap [held item].  Works even if one of the Pokémon isn't holding anything.  If either Pokémon is holding mail, this move will [fail].

If either Pokémon has multitype or sticky-hold, this move will [fail].

If this move results in a Pokémon obtaining choice-band, choice-scarf, or choice-specs, and that Pokémon was the latter of the pair to move this turn, then the move it used this turn becomes its chosen forced move.  This applies even if both Pokémon had a choice item before this move was used.  If the first of the two Pokémon gains a choice item, it may select whatever choice move it wishes next turn.

Neither the user nor the target can recover its item with recycle.

This move cannot be selected by assist or metronome."
179,9,Copies the target's ability.,"User's ability is replaced with the target's until the user leaves the [field].  Ignores [accuracy] and [evasion] modifiers.

If the target has flower-gift, forecast, illusion, imposter, multitype, stance-change, trace, wonder-guard, or zen-mode, this move will [fail].

This move cannot be copied by mirror-move."
180,9,User will recover half its max HP at the end of the next turn.,"At the end of the next turn, user will be healed for half its max [HP].  If the user is [switched out], its replacement will be healed instead for half of the user's max HP.  If the user [faint] or is forcefully switched by roar or whirlwind, this effect will not activate."
181,9,Randomly selects and uses one of the trainer's other Pokémon's moves.,"Uses a move from another Pokémon in the user's party, both selected at random.  Moves from fainted Pokémon can be used.  If there are no eligible Pokémon or moves, this move will [fail].

This move will not select assist, chatter, circle-throw, copycat, counter, covet, destiny-bond, detect, dig, dive, dragon-tail, endure, feint, fly focus-punch, follow-me, helping-hand, me-first, metronome, mimic, mirror-coat, mirror-move, phantom-force protect, quick-guard, roar shadow-force, sketch, sleep-talk, snatch, struggle, switcheroo, thief, trick, whirlwind, or wide-guard.

This move cannot be copied by mirror-move, nor selected by metronome or sleep-talk."
